Nombre,Enlace,Categoria,CantidadArticulos
Journal of the Electrochemical Society,http://jes.ecsdl.org/,Q2,4478
"Biofuels, Bioproducts and Biorefining",https://onlinelibrary.wiley.com/journal/19321031,Q2,248
Biomass and Bioenergy,https://www.journals.elsevier.com/biomass-and-bioenergy,Q2,885
Sustainable Environment Research,https://sustainenvironres.biomedcentral.com/,Q2,140
Wiley Interdisciplinary Reviews: Energy and Environment,https://onlinelibrary.wiley.com/journal/2041840x,Q2,120
Sustainable Development,https://onlinelibrary.wiley.com/journal/10991719,Q2,160
Journal of Wind Engineering and Industrial Aerodynamics,http://www.elsevier.com/wps/find/journaldescription.cws_home/505658/description#description,Q2,652
International Journal of Sustainable Built Environment,https://www.gord.qa/institute/ijsbe,Q2,108
Sustainable Production and Consumption,https://www.journals.elsevier.com/sustainable-production-and-consumption,Q2,127
Wind Energy,https://onlinelibrary.wiley.com/journal/10991824,Q2,371
High Voltage,https://www.scimagojr.com/journalsearch.php?q=21100931381&tip=sid&clean=0,Q2,76
Dianli Xitong Zidonghua/Automation of Electric Power Systems,http://www.aeps-info.com/aeps/home,Q2,1793
Bioresources and Bioprocessing,https://bioresourcesbioprocessing.springeropen.com/,Q2,156
Petroleum,http://www.keaipublishing.com/en/journals/petroleum/,Q2,137
Journal of Propulsion and Power,https://arc.aiaa.org/jpp/about,Q2,433
Climate Law,https://www.scimagojr.com/journalsearch.php?q=21100220394&tip=sid&clean=0,Q2,52
Energy Efficiency,http://www.springer.com/engineering/energy+technology/journal/12053,Q2,311
"Journal of King Saud University, Engineering Sciences",https://www.journals.elsevier.com/journal-of-king-saud-university-engineering-sciences/,Q2,136
Bioresource Technology Reports,https://www.scimagojr.com/journalsearch.php?q=21100933233&tip=sid&clean=0,Q2,96
"Journal of Energy Resources Technology, Transactions of the ASME",http://asmedl.aip.org/EnergyResources/,Q2,424
SPE Production and Operations,http://www.spe.org/papers/pubs/POjournal.php,Q2,157
Petroleum Exploration and Development,https://www.sciencedirect.com/journal/petroleum-exploration-and-development,Q2,351
Progress in Nuclear Energy,https://www.journals.elsevier.com/progress-in-nuclear-energy,Q2,686
Energy Science and Engineering,https://onlinelibrary.wiley.com/journal/20500505,Q2,123
Nanotechnology Reviews,https://www.scimagojr.com/journalsearch.php?q=21100372101&tip=sid&clean=0,Q2,130
Journal of Petroleum Geology,http://www.wiley.com/bw/journal.asp?ref=0141-6421,Q2,64
South African Journal of Chemical Engineering,https://www.journals.elsevier.com/south-african-journal-of-chemical-engineering,Q2,85
"Sustainability Accounting, Management and Policy Journal",https://www.scimagojr.com/journalsearch.php?q=21100227406&tip=sid&clean=0,Q2,79
SAE International Journal of Fuels and Lubricants,https://www.sae.org/publications/collections/content/E-JOURNAL-04/,Q2,171
Environment,http://www.heldref.org/pubs/env/about.html,Q2,84
Journal of Chemical Technology and Biotechnology,http://www3.interscience.wiley.com/journal/117946200/grouphome/home.html,Q2,1051
Meitan Xuebao/Journal of the China Coal Society,https://www.scimagojr.com/journalsearch.php?q=16430&tip=sid&clean=0,Q2,1510
"Energy, Sustainability and Society",https://energsustainsoc.biomedcentral.com/,Q2,109
International Journal of Spray and Combustion Dynamics,https://www.scimagojr.com/journalsearch.php?q=19800188068&tip=sid&clean=0,Q2,83
Frontiers in Energy Research,https://www.frontiersin.org/journals/energy-research,Q2,191
Energies,https://www.mdpi.com/journal/energies,Q2,6667
Agroecology and Sustainable Food Systems,https://www.tandfonline.com/loi/wjsa21,Q2,189
Bioenergy Research,https://www.springer.com/journal/12155,Q2,275
Journal of Engineering for Gas Turbines and Power,http://www.asmedl.org/GasTurbinesPower,Q2,840
International Journal on Energy Conversion,https://www.praiseworthyprize.org/jsm/index.php?journal=irecon,Q2,49
Electricity Journal,https://www.journals.elsevier.com/the-electricity-journal,Q2,296
Clean Energy,https://www.scimagojr.com/journalsearch.php?q=21100936535&tip=sid&clean=0,Q2,27
Journal of Daylighting,http://solarlits.com/jd/index,Q2,10
Journal of Nuclear Science and Technology,http://wwwsoc.nii.ac.jp/aesj/jnst/,Q2,516
"Journal of Solar Energy Engineering, Transactions of the ASME",http://www.asmedl.org/Solar,Q2,297
IEEE Transactions on Nuclear Science,http://ieeexplore.ieee.org/xpl/RecentIssue.jsp?punumber=23,Q2,1146
Combustion Science and Technology,http://www.informaworld.com/smpp/title~content=t713456315~db=all,Q2,396
Geothermal Energy,https://link.springer.com/journal/40517,Q2,74
International Journal of Air-Conditioning and Refrigeration,https://www.worldscientific.com/worldscinet/ijacr,Q2,116
Journal of Offshore Mechanics and Arctic Engineering,https://asmedigitalcollection.asme.org/offshoremechanics,Q2,234
"International Journal of Turbomachinery, Propulsion and Power",https://www.scimagojr.com/journalsearch.php?q=21100943564&tip=sid&clean=0,Q2,47
Horticultural Plant Journal,https://www.scimagojr.com/journalsearch.php?q=21100900275&tip=sid&clean=0,Q2,31
Sustainability,https://www.mdpi.com/journal/sustainability,Q2,8731
Waste and Biomass Valorization,https://www.scimagojr.com/journalsearch.php?q=19600157918&tip=sid&clean=0,Q2,691
Fuel Cells,http://www3.interscience.wiley.com/journal/84502986/home,Q2,282
Nuclear Science and Techniques/Hewuli,http://www.sciencedirect.com/science/journal/10018042,Q2,522
Fusion Engineering and Design,http://www.elsevier.com/wps/find/journaldescription.cws_home/505650/description#description,Q2,2163
Journal of Sustainable Mining,https://www.scimagojr.com/journalsearch.php?q=21100871631&tip=sid&clean=0,Q2,75
"Proceedings of the Institution of Mechanical Engineers, Part A: Journal of Power and Energy",http://journals.pepublishing.com/content/119773/?p=77e7558342cd4fea9265b1879a2b39f5&pi=2,Q2,192
Batteries,https://www.mdpi.com/journal/batteries,Q2,147
Energy Systems,https://www.springer.com/engineering/journal/12667,Q2,128
Nuclear Technology,http://www.new.ans.org/pubs/journals/nt/,Q2,356
SPE Drilling and Completion,http://www.spe.org/papers/pubs/DCjournal.php,Q2,87
Gaodianya Jishu/High Voltage Engineering,http://gdyjs.periodicals.net.cn/default.html,Q2,1552
Journal of Combustion,https://www.scimagojr.com/journalsearch.php?q=19700201407&tip=sid&clean=0,Q2,54
International Journal of Energy and Environmental Engineering,https://www.springer.com/engineering/journal/40095,Q2,102
Dianli Zidonghua Shebei / Electric Power Automation Equipment,http://ores.su/en/journals/dianli-zidonghua-shebei--electric-power-automation-equipment/,Q2,1104
Frontiers in Energy,https://www.springer.com/journal/11708,Q2,183
Journal of Electrochemical Energy Conversion and Storage,http://electrochemical.asmedigitalcollection.asme.org/journal.aspx,Q2,111
Propulsion and Power Research,http://www.keaipublishing.com/en/journals/propulsion-and-power-research/,Q2,99
Zhongguo Shiyou Daxue Xuebao (Ziran Kexue Ban)/Journal of China University of Petroleum (Edition of Natural Science),http://www.ceps.com.tw/ec/ecJnlIntro.aspx?Jnliid=1280,Q2,409
Journal of Energy Engineering - ASCE,http://pubs.asce.org/journals/energy/default.htm,Q2,323
Materials for Renewable and Sustainable Energy,https://www.springer.com/materials/journal/40243,Q2,61
Thermophysics and Aeromechanics,http://www.springer.com/new+%26+forthcoming+titles+%28default%29/journal/11510,Q2,286
Energy Exploration and Exploitation,http://www.multi-science.co.uk/eee.htm,Q2,183
"Energy Sources, Part B: Economics, Planning and Policy",https://www.tandfonline.com/toc/uesb20/current,Q2,367
SOCAR Proceedings,https://www.scimagojr.com/journalsearch.php?q=5800184384&tip=sid&clean=0,Q2,110
Petroleum Science,http://www.springer.com/earth+sciences+%26+geography/journal/12182,Q2,203
Petrophysics,https://www.scimagojr.com/journalsearch.php?q=18794&tip=sid&clean=0,Q2,107
Petroleum Geoscience,http://pg.geoscienceworld.org/,Q2,125
International Journal of Computational Fluid Dynamics,https://www.tandfonline.com/loi/gcfd20,Q2,102
"Energy, Ecology and Environment",https://www.scimagojr.com/journalsearch.php?q=21100900376&tip=sid&clean=0,Q2,102
Arab Journal of Basic and Applied Sciences,https://www.tandfonline.com/toc/tabs20/current,Q2,116
Energy and Environment,https://journals.sagepub.com/home/eae,Q2,177
International Journal of Geo-Engineering,https://www.scimagojr.com/journalsearch.php?q=21100898838&tip=sid&clean=0,Q2,80
Oil and Gas Science and Technology,https://ogst.ifpenergiesnouvelles.fr/,Q2,166
Science and Technology of Nuclear Installations,https://www.scimagojr.com/journalsearch.php?q=19700200879&tip=sid&clean=0,Q2,192
Fusion Science and Technology,http://www.new.ans.org/pubs/journals/fst/,Q2,402
International Transactions on Electrical Energy Systems,https://onlinelibrary.wiley.com/journal/20507038,Q2,545
Journal of Spatial Science,https://www.scimagojr.com/journalsearch.php?q=62444&tip=sid&clean=0,Q2,89
Radiation Detection Technology and Methods,https://www.scimagojr.com/journalsearch.php?q=21100921312&tip=sid&clean=0,Q2,73
IEEJ Journal of Industry Applications,https://www.jstage.jst.go.jp/browse/ieejjia,Q2,189
International Journal of Sustainable Energy,http://www.informaworld.com/smpp/title~content=t782909026~db=all,Q2,189
Xinan Shiyou Xueyuan Xuebao/Journal of Southwestern Petroleum Institute,https://www.scimagojr.com/journalsearch.php?q=20118&tip=sid&clean=0,Q2,377
New Space,https://home.liebertpub.com/publications/new-space/610,Q2,105
Proceedings of Institution of Civil Engineers: Energy,https://www.icevirtuallibrary.com/toc/jener/current,Q2,57
Physica C: Superconductivity and its Applications,http://www.elsevier.com/wps/find/journaldescription.cws_home/505713/description#description,Q2,473
Rudarsko Geolosko Naftni Zbornik,http://hrcak.srce.hr/index.php?show=casopis&id_casopis=94,Q2,87
"Journal of Sustainable Development of Energy, Water and Environment Systems",http://www.sdewes.org/jsdewes/,Q2,117
Carbon Letters,http://carbonlett.org/main/,Q2,178
Thermal Engineering (English translation of Teploenergetika),http://pleiades.online/en/journal/thermeng/,Q2,407
Petroleum Science and Technology,http://www.informaworld.com/smpp/title~content=t713597288~db=all,Q2,928
Journal of Energy and Natural Resources Law,https://www.tandfonline.com/loi/rnrl20,Q2,85
IEEE Industry Applications Magazine,http://ieeexplore.ieee.org/xpl/RecentIssue.jsp?punumber=2943,Q2,215
Journal of Engineering Thermophysics,http://www.springer.com/new+%26+forthcoming+titles+%28default%29/journal/11823,Q2,159
Oil Shale,http://www.kirj.ee/oilshale,Q2,77
International Journal of Energy Economics and Policy,https://www.scimagojr.com/journalsearch.php?q=21100281302&tip=sid&clean=0,Q2,533
Journal of Energy Markets,https://www.scimagojr.com/journalsearch.php?q=21100894526&tip=sid&clean=0,Q2,46
International Journal of Exergy,http://www.inderscience.com/browse/index.php?journalID=135,Q2,197
Journal of Radioanalytical and Nuclear Chemistry,http://www.springer.com/chemistry/journal/10967,Q2,2123
International Journal of Coal Preparation and Utilization,http://www.informaworld.com/smpp/title~content=t713455898~db=all,Q2,177
Journal of Energy in Southern Africa,https://www.scimagojr.com/journalsearch.php?q=27018&tip=sid&clean=0,Q2,89
Journal of Neutron Research,https://www.scimagojr.com/journalsearch.php?q=21100326279&tip=sid&clean=0,Q2,47
Journal of Petroleum Exploration and Production Technology,https://www.springer.com/journal/13202,Q2,315
Industrial Lubrication and Tribology,http://www.emeraldgrouppublishing.com/products/journals/journals.htm?id=ilt,Q2,442
