Nombre,Enlace,Categoria,CantidadArticulos
Nature Nanotechnology,https://www.nature.com/nnano/,Q1,760
Nature Materials,http://www.nature.com/nmat/index.html,Q1,801
Nature Biotechnology,https://www.nature.com/nbt/,Q1,1088
Advanced Materials,https://onlinelibrary.wiley.com/journal/15214095,Q1,4162
Nano Futures,https://iopscience.iop.org/journal/2399-1984,Q1,56
Materials Today,https://www.journals.elsevier.com/materials-today,Q1,417
Nature Electronics,https://www.nature.com/natelectron/,Q1,176
IEEE Communications Surveys and Tutorials,https://ieeexplore.ieee.org/xpl/RecentIssue.jsp?punumber=9739,Q1,355
Materials Science and Engineering: R: Reports,http://www.elsevier.com/wps/find/journaldescription.cws_home/505673/description#description,Q1,37
Nano Today,https://www.journals.elsevier.com/nano-today/,Q1,150
ACS Nano,http://pubs.acs.org/journal/ancac3,Q1,3990
Nature Biomedical Engineering,https://www.nature.com/natbiomedeng/,Q1,312
Nano Letters,https://pubs.acs.org/journal/nalefd,Q1,3469
Nano Energy,https://www.journals.elsevier.com/nano-energy,Q1,2122
International Materials Reviews,https://www.tandfonline.com/loi/yimr20,Q1,54
Advanced Science,https://onlinelibrary.wiley.com/journal/21983844,Q1,702
Science Robotics,https://robotics.sciencemag.org/,Q1,119
Materials Horizons,https://pubs.rsc.org/en/journals/journalissues/mh#!recentarticles&adv,Q1,300
IEEE Transactions on Cybernetics,https://ieeexplore.ieee.org/xpl/RecentIssue.jsp?punumber=6221036,Q1,982
IEEE Communications Magazine,https://ieeexplore.ieee.org/xpl/RecentIssue.jsp?punumber=35,Q1,1067
Automatica,http://www.elsevier.com/wps/find/journaldescription.cws_home/270/description#description,Q1,1481
International Journal of Machine Tools and Manufacture,http://www.elsevier.com/wps/find/journaldescription.cws_home/264/description#description,Q1,269
Journal of Operations Management,https://onlinelibrary.wiley.com/journal/18731317,Q1,103
IEEE Transactions on Automatic Control,https://ieeexplore.ieee.org/xpl/aboutJournal.jsp?punumber=9,Q1,1534
IEEE Journal on Selected Areas in Communications,http://ieeexplore.ieee.org/xpl/RecentIssue.jsp?punumber=49,Q1,732
"IEEE Transactions on Systems, Man, and Cybernetics Part A:Systems and Humans",https://ieeexplore.ieee.org/xpl/RecentIssue.jsp?punumber=6221021,Q1,163
Annual Review of Biomedical Engineering,https://www.annualreviews.org/journal/bioeng,Q1,53
npj 2D Materials and Applications,https://www.nature.com/npj2dmaterials/,Q1,80
IEEE Wireless Communications,https://ieeexplore.ieee.org/xpl/RecentIssue.jsp?punumber=7742,Q1,356
International Journal of Engineering Science,https://www.journals.elsevier.com/international-journal-of-engineering-science,Q1,359
Small,https://onlinelibrary.wiley.com/journal/16136829,Q1,2516
Cement and Concrete Research,http://www.elsevier.com/wps/find/journaldescription.cws_home/352/description#description,Q1,584
IEEE Geoscience and Remote Sensing Magazine,https://ieeexplore.ieee.org/xpl/RecentIssue.jsp?punumber=6245518,Q1,93
Applied Energy,https://www.journals.elsevier.com/applied-energy,Q1,5177
npj Computational Materials,https://www.nature.com/npjcompumats/,Q1,163
IEEE Transactions on Power Systems,https://ieeexplore.ieee.org/xpl/RecentIssue.jsp?punumber=59,Q1,1669
Archive for Rational Mechanics and Analysis,http://www.editorialmanager.com/arma/default.aspx,Q1,373
"Transportation Research, Part C: Emerging Technologies",https://www.journals.elsevier.com/transportation-research-part-c-emerging-technologies,Q1,793
Journal of Engineering Education,https://onlinelibrary.wiley.com/journal/21689830,Q1,93
IEEE Transactions on Medical Imaging,https://ieeexplore.ieee.org/xpl/RecentIssue.jsp?punumber=42,Q1,714
Research Policy,https://www.journals.elsevier.com/research-policy,Q1,455
International Journal of Robotics Research,https://journals.sagepub.com/home/ijr,Q1,258
IEEE Transactions on Fuzzy Systems,http://ieeexplore.ieee.org/xpl/RecentIssue.jsp?punumber=91,Q1,609
2D Materials,https://iopscience.iop.org/journal/2053-1583,Q1,669
Journal of Product Innovation Management,https://onlinelibrary.wiley.com/journal/15405885,Q1,172
ISPRS Journal of Photogrammetry and Remote Sensing,https://www.journals.elsevier.com/isprs-journal-of-photogrammetry-and-remote-sensing,Q1,632
Biomaterials,https://www.journals.elsevier.com/biomaterials,Q1,1801
ACS Photonics,https://pubs.acs.org/journal/apchd5,Q1,1409
International Journal of Plasticity,https://www.journals.elsevier.com/international-journal-of-plasticity,Q1,442
"IEEE Transactions on Systems, Man, and Cybernetics: Systems",https://ieeexplore.ieee.org/xpl/RecentIssue.jsp?punumber=6221021,Q1,800
Water Research,https://www.journals.elsevier.com/water-research,Q1,2581
IEEE Journal of Solid-State Circuits,https://ieeexplore.ieee.org/xpl/RecentIssue.jsp?punumber=4,Q1,875
IEEE Transactions on Industrial Electronics,https://ieeexplore.ieee.org/xpl/RecentIssue.jsp?punumber=41,Q1,2761
Transportation Research Part B: Methodological,https://www.journals.elsevier.com/transportation-research-part-b-methodological,Q1,592
Production and Operations Management,https://onlinelibrary.wiley.com/journal/19375956,Q1,389
Current Opinion in Biotechnology,https://www.sciencedirect.com/journal/current-opinion-in-biotechnology,Q1,469
IEEE Transactions on Power Electronics,https://ieeexplore.ieee.org/xpl/aboutJournal.jsp?punumber=63,Q1,2504
IEEE Transactions on Robotics,https://ieeexplore.ieee.org/xpl/RecentIssue.jsp?punumber=8860,Q1,357
Transportation Science,https://pubsonline.informs.org/journal/trsc,Q1,250
Technovation,https://www.journals.elsevier.com/technovation,Q1,120
Computer Methods in Applied Mechanics and Engineering,https://www.journals.elsevier.com/computer-methods-in-applied-mechanics-and-engineering,Q1,1319
Biosensors and Bioelectronics,http://www.elsevier.com/wps/find/journaldescription.cws_home/405913/description#description,Q1,2868
Cement and Concrete Composites,https://www.journals.elsevier.com/cement-and-concrete-composites,Q1,586
IEEE Transactions on Wireless Communications,https://ieeexplore.ieee.org/xpl/RecentIssue.jsp?punumber=7693,Q1,1833
Nanophotonics,https://www.degruyter.com/view/journals/nanoph/nanoph-overview.xml,Q1,278
IEEE Transactions on Geoscience and Remote Sensing,https://ieeexplore.ieee.org/xpl/RecentIssue.jsp?punumber=36,Q1,1704
IEEE Journal of Emerging and Selected Topics in Power Electronics,https://ieeexplore.ieee.org/xpl/RecentIssue.jsp?punumber=6245517,Q1,504
CIRP Annals - Manufacturing Technology,https://www.journals.elsevier.com/cirp-annals,Q1,466
Nano Research,https://www.springer.com/journal/12274,Q1,1268
Progress in Aerospace Sciences,https://www.journals.elsevier.com/progress-in-aerospace-sciences,Q1,92
Nano-Micro Letters,https://www.springer.com/journal/40820,Q1,150
Lab on a Chip - Miniaturisation for Chemistry and Biology,https://www.rsc.org/journals-books-databases/about-journals/lab-on-a-chip/,Q1,1209
IEEE Signal Processing Magazine,https://www.ieee.org/membership-catalog/productdetail/showProductDetailPage.html?product=PER310-PRT,Q1,279
IEEE Transactions on Control of Network Systems,https://ieeexplore.ieee.org/xpl/RecentIssue.jsp?punumber=6509490,Q1,295
International Journal of Production Economics,https://www.journals.elsevier.com/international-journal-of-production-economics,Q1,879
IEEE Transactions on Industrial Informatics,http://ieeexplore.ieee.org/xpl/RecentIssue.jsp?punumber=9424,Q1,1127
Proceedings of the IEEE,https://ieeexplore.ieee.org/xpl/RecentIssue.jsp?punumber=5,Q1,442
Chemical Engineering Journal,https://www.journals.elsevier.com/chemical-engineering-journal,Q1,5740
IEEE Industrial Electronics Magazine,https://ieeexplore.ieee.org/xpl/RecentIssue.jsp?punumber=4154573,Q1,97
Global Food Security,https://www.journals.elsevier.com/global-food-security,Q1,145
Transportation Research Part E: Logistics and Transportation Review,https://www.journals.elsevier.com/transportation-research-part-e-logistics-and-transportation-review,Q1,467
Progress in Quantum Electronics,https://www.journals.elsevier.com/progress-in-quantum-electronics,Q1,28
Journal of Machine Learning Research,http://www.jmlr.org/,Q1,694
IEEE Journal on Selected Topics in Signal Processing,https://ieeexplore.ieee.org/xpl/RecentIssue.jsp?punumber=4200690,Q1,352
Additive Manufacturing,https://www.journals.elsevier.com/additive-manufacturing,Q1,496
Mechanical Systems and Signal Processing,https://www.journals.elsevier.com/mechanical-systems-and-signal-processing/,Q1,1547
Energy,https://www.journals.elsevier.com/energy,Q1,5727
Wiley interdisciplinary reviews. Nanomedicine and nanobiotechnology,https://onlinelibrary.wiley.com/journal/19390041,Q1,141
Advanced healthcare materials,https://onlinelibrary.wiley.com/journal/21922659,Q1,998
IEEE Transactions on Power Delivery,http://ieeexplore.ieee.org/xpl/RecentIssue.jsp?punumber=61,Q1,923
IEEE Transactions on Communications,https://ieeexplore.ieee.org/xpl/aboutJournal.jsp?punumber=26,Q1,1303
Rock Mechanics and Rock Engineering,https://www.springer.com/journal/603,Q1,805
Biofabrication,https://iopscience.iop.org/journal/1758-5090,Q1,250
Proceedings of the Combustion Institute,https://www.journals.elsevier.com/proceedings-of-the-combustion-institute,Q1,503
Journal of Manufacturing Systems,https://www.journals.elsevier.com/journal-of-manufacturing-systems,Q1,280
Journal of Power Sources,https://www.journals.elsevier.com/journal-of-power-sources,Q1,4188
Transportation Research Part A: Policy and Practice,https://www.journals.elsevier.com/transportation-research-part-a-policy-and-practice,Q1,760
IEEE Transactions on Signal Processing,http://ieeexplore.ieee.org/xpl/RecentIssue.jsp?punumber=78,Q1,1425
Energy and Buildings,https://www.journals.elsevier.com/energy-and-buildings,Q1,2686
IEEE Vehicular Technology Magazine,https://ieeexplore.ieee.org/xpl/RecentIssue.jsp?punumber=10209,Q1,164
Scripta Materialia,https://www.sciencedirect.com/journal/scripta-materialia,Q1,1543
ACS Synthetic Biology,https://pubs.acs.org/journal/asbcd6,Q1,729
IEEE Power and Energy Magazine,https://ieeexplore.ieee.org/xpl/RecentIssue.jsp?punumber=8014,Q1,235
Journal of the ACM,https://dl.acm.org/journal/jacm,Q1,149
"Nanotechnology, Science and Applications",https://www.dovepress.com/nanotechnology-science-and-applications-journal,Q1,23
Structural Safety,https://www.journals.elsevier.com/structural-safety,Q1,175
Microsystems and Nanoengineering,https://www.nature.com/micronano/,Q1,118
Tunnelling and Underground Space Technology,http://www.elsevier.com/wps/find/journaldescription.cws_home/799/description#description,Q1,817
IEEE/ASME Transactions on Mechatronics,http://ieeexplore.ieee.org/xpl/RecentIssue.jsp?punumber=3516,Q1,846
Soft Robotics,http://online.liebertpub.com/soro,Q1,128
IEEE Transactions on Control Systems Technology,http://ieeexplore.ieee.org/xpl/RecentIssue.jsp?punumber=87,Q1,662
Nonlinear Analysis: Hybrid Systems,https://www.journals.elsevier.com/nonlinear-analysis-hybrid-systems,Q1,217
Canadian Geotechnical Journal,http://www.nrcresearchpress.com/journal/cgj,Q1,480
Composites Part B: Engineering,https://www.journals.elsevier.com/composites-part-b-engineering,Q1,2171
Reliability Engineering and System Safety,https://www.journals.elsevier.com/reliability-engineering-and-system-safety,Q1,808
Journal of the Mechanics and Physics of Solids,https://www.journals.elsevier.com/journal-of-the-mechanics-and-physics-of-solids,Q1,690
Quantum Science and Technology,https://iopscience.iop.org/journal/2058-9565,Q1,186
IEEE Transactions on Information Forensics and Security,http://ieeexplore.ieee.org/xpl/RecentIssue.jsp?punumber=10206,Q1,695
IEEE Transactions on Intelligent Transportation Systems,https://ieeexplore.ieee.org/xpl/RecentIssue.jsp?punumber=6979,Q1,951
IEEE Transactions on Transportation Electrification,https://ieeexplore.ieee.org/xpl/RecentIssue.jsp?punumber=6687316,Q1,209
Journal of Intelligent Transportation Systems,https://www.tandfonline.com/loi/gits20,Q1,127
Journal of Cleaner Production,https://www.journals.elsevier.com/journal-of-cleaner-production,Q1,8612
IEEE Transactions on Multimedia,https://ieeexplore.ieee.org/xpl/RecentIssue.jsp?punumber=6046,Q1,687
Computer-Aided Civil and Infrastructure Engineering,https://onlinelibrary.wiley.com/journal/14678667,Q1,193
Building and Environment,https://www.journals.elsevier.com/building-and-environment,Q1,1462
Advanced Materials Technologies,https://onlinelibrary.wiley.com/journal/2365709X#pane-01cbe741-499a-4611-874e-1061f1f4679e01,Q1,437
Progress in Photovoltaics: Research and Applications,https://onlinelibrary.wiley.com/journal/1099159x,Q1,346
Journal of Magnesium and Alloys,http://www.keaipublishing.com/en/journals/journal-of-magnesium-and-alloys/,Q1,130
Acta Biomaterialia,https://www.sciencedirect.com/journal/acta-biomaterialia,Q1,1817
Dental Materials,https://www.journals.elsevier.com/dental-materials,Q1,590
Composites Part A: Applied Science and Manufacturing,https://www.journals.elsevier.com/composites-part-a-applied-science-and-manufacturing,Q1,1157
Transportation,https://www.springer.com/journal/11116,Q1,255
Osteoarthritis and Cartilage,https://www.journals.elsevier.com/osteoarthritis-and-cartilage,Q1,721
Composites Science and Technology,https://www.journals.elsevier.com/composites-science-and-technology,Q1,1193
Georisk,https://www.tandfonline.com/toc/ngrk20/current,Q1,69
Coastal Engineering,https://www.sciencedirect.com/journal/coastal-engineering,Q1,403
Desalination,https://www.sciencedirect.com/journal/desalination,Q1,1134
Materials and Design,https://www.sciencedirect.com/journal/materials-and-design,Q1,3596
Critical Reviews in Food Science and Nutrition,https://www.tandfonline.com/toc/bfsn20/current,Q1,674
Robotics and Computer-Integrated Manufacturing,https://www.journals.elsevier.com/robotics-and-computer-integrated-manufacturing,Q1,322
Systems and Control Letters,https://www.journals.elsevier.com/systems-and-control-letters/,Q1,435
Composite Structures,https://www.journals.elsevier.com/composite-structures,Q1,3303
Applied Thermal Engineering,https://www.journals.elsevier.com/applied-thermal-engineering,Q1,5724
IEEE Transactions on Energy Conversion,https://ieeexplore.ieee.org/xpl/RecentIssue.jsp?punumber=60,Q1,567
International Journal of Production Research,https://www.tandfonline.com/toc/tprs20/current,Q1,1332
Science Technology and Human Values,https://journals.sagepub.com/home/sth,Q1,136
European Physical Journal C,https://www.springer.com/journal/10052,Q1,2648
Tissue Engineering - Part B: Reviews,https://www.liebertpub.com/loi/teb,Q1,116
Journal of Industrial Information Integration,https://www.journals.elsevier.com/journal-of-industrial-information-integration,Q1,61
Journal of Materials Science and Technology,https://www.journals.elsevier.com/journal-of-materials-science-and-technology,Q1,704
Protection and Control of Modern Power Systems,https://pcmp.springeropen.com/,Q1,39
Information Sciences,https://www.journals.elsevier.com/information-sciences,Q1,2171
Annual Reviews in Control,https://www.sciencedirect.com/journal/annual-reviews-in-control,Q1,132
IEEE Communications Standards Magazine,https://www.comsoc.org/publications/magazines/ieee-communications-standards-magazine,Q1,126
"Materials Science & Engineering A: Structural Materials: Properties, Microstructure and Processing",https://www.journals.elsevier.com/materials-science-and-engineering-a,Q1,4157
Extreme Mechanics Letters,https://www.journals.elsevier.com/extreme-mechanics-letters,Q1,329
IEEE Transactions on Antennas and Propagation,https://ieeexplore.ieee.org/xpl/RecentIssue.jsp?punumber=8,Q1,2428
Journal of the Royal Society Interface,https://royalsocietypublishing.org/journal/rsif,Q1,776
Accident Analysis and Prevention,https://www.journals.elsevier.com/accident-analysis-and-prevention,Q1,1002
Automation in Construction,http://www.elsevier.com/wps/find/journaldescription.cws_home/523112/description#description,Q1,691
npj Regenerative Medicine,https://www.nature.com/npjregenmed/,Q1,34
Journal of Fluid Mechanics,https://www.cambridge.org/core/journals/journal-of-fluid-mechanics,Q1,2396
International Journal of Impact Engineering,https://www.journals.elsevier.com/international-journal-of-impact-engineering,Q1,606
Virtual and Physical Prototyping,https://www.tandfonline.com/loi/nvpp20,Q1,97
Transportation Research Part D: Transport and Environment,https://www.journals.elsevier.com/transportation-research-part-d-transport-and-environment,Q1,740
Journal of Technology Transfer,https://www.springer.com/journal/10961,Q1,226
International Journal of Heat and Mass Transfer,https://www.journals.elsevier.com/international-journal-of-heat-and-mass-transfer,Q1,4447
Journal of Structural Engineering,https://ascelibrary.org/journal/jsendh,Q1,908
Structural and Multidisciplinary Optimization,https://www.springer.com/journal/158,Q1,762
IEEE Wireless Communications Letters,https://ieeexplore.ieee.org/xpl/RecentIssue.jsp?punumber=5962382,Q1,655
IEEE Transactions on Vehicular Technology,https://ieeexplore.ieee.org/xpl/RecentIssue.jsp?punumber=25,Q1,2954
Journal of Materials Processing Technology,https://www.journals.elsevier.com/journal-of-materials-processing-technology,Q1,1369
International Journal of Robust and Nonlinear Control,https://onlinelibrary.wiley.com/journal/10991239,Q1,852
"Sensors and Actuators, B: Chemical",https://www.journals.elsevier.com/sensors-and-actuators-b-chemical,Q1,6498
Computational Mechanics,https://www.springer.com/journal/466,Q1,360
Journal of Neural Engineering,https://iopscience.iop.org/journal/1741-2552,Q1,544
Engineering Structures,https://www.journals.elsevier.com/engineering-structures,Q1,2634
IEEE Transactions on Microwave Theory and Techniques,https://ieeexplore.ieee.org/xpl/RecentIssue.jsp?punumber=22,Q1,1562
International Journal for Numerical Methods in Engineering,https://onlinelibrary.wiley.com/journal/10970207,Q1,716
Applied Mechanics Reviews,https://asmedigitalcollection.asme.org/appliedmechanicsreviews,Q1,60
"Journal of Guidance, Control, and Dynamics",https://arc.aiaa.org/journal/jgcd,Q1,803
APL Materials,https://aip.scitation.org/journal/apm,Q1,509
IEEE Robotics and Automation Letters,https://ieeexplore.ieee.org/xpl/RecentIssue.jsp?punumber=7083369,Q1,1040
Advanced Materials Interfaces,https://onlinelibrary.wiley.com/journal/21967350,Q1,1366
Bioactive Materials,http://www.keaipublishing.com/en/journals/bioactive-materials/,Q1,97
International Journal of Refrigeration,https://www.journals.elsevier.com/international-journal-of-refrigeration,Q1,955
Polymer Reviews,https://www.tandfonline.com/loi/lmsc20,Q1,68
Tribology International,https://www.journals.elsevier.com/tribology-international,Q1,1603
"Computers, Materials and Continua",https://www.techscience.com/cmc/,Q1,165
IEEE/CAA Journal of Automatica Sinica,https://ieeexplore.ieee.org/xpl/RecentIssue.jsp?punumber=6570654,Q1,294
IEEE Transactions on Dependable and Secure Computing,http://ieeexplore.ieee.org/xpl/RecentIssue.jsp?punumber=8858,Q1,296
Journal of Scientific Computing,https://www.springer.com/journal/10915,Q1,742
Mobile Media and Communication,https://journals.sagepub.com/home/mmc,Q1,71
Computers and Structures,https://www.journals.elsevier.com/computers-and-structures,Q1,519
Journal of Constructional Steel Research,https://www.sciencedirect.com/journal/journal-of-constructional-steel-research,Q1,1000
IEEE Transactions on Mobile Computing,https://ieeexplore.ieee.org/xpl/aboutJournal.jsp?punumber=7755,Q1,716
Synthetic Biology,https://academic.oup.com/synbio,Q1,7
IEEE Transactions on Automation Science and Engineering,https://ieeexplore.ieee.org/xpl/RecentIssue.jsp?punumber=8856,Q1,449
IEEE Transactions on Industry Applications,https://ieeexplore.ieee.org/xpl/aboutJournal.jsp?punumber=28,Q1,1740
Journal of Composites for Construction,https://ascelibrary.org/journal/jccof2,Q1,320
IEEE/ACM Transactions on Networking,https://ieeexplore.ieee.org/xpl/RecentIssue.jsp?punumber=90,Q1,760
IEEE Geoscience and Remote Sensing Letters,http://ieeexplore.ieee.org/xpl/RecentIssue.jsp?punumber=8859,Q1,1289
ACS Applied Energy Materials,https://pubs.acs.org/journal/aaemcq,Q1,842
Expert Systems with Applications,https://www.journals.elsevier.com/expert-systems-with-applications,Q1,1877
International Journal of Sustainable Transportation,https://www.tandfonline.com/loi/ujst20,Q1,219
Construction and Building Materials,https://www.journals.elsevier.com/construction-and-building-materials,Q1,6942
IEEE Antennas and Wireless Propagation Letters,https://ieeexplore.ieee.org/xpl/aboutJournal.jsp?punumber=7727,Q1,1875
Structural Control and Health Monitoring,https://onlinelibrary.wiley.com/journal/15452263,Q1,469
International Journal of Fatigue,https://www.journals.elsevier.com/international-journal-of-fatigue,Q1,1149
Computers and Industrial Engineering,https://www.journals.elsevier.com/computers-and-industrial-engineering,Q1,1244
Nonlinear Analysis: Real World Applications,https://www.journals.elsevier.com/nonlinear-analysis-real-world-applications,Q1,430
Polymer Chemistry,https://www.rsc.org/journals-books-databases/about-journals/polymer-chemistry/,Q1,2124
International Journal of Mechanical Sciences,https://www.journals.elsevier.com/international-journal-of-mechanical-sciences,Q1,1426
Thin-Walled Structures,https://www.sciencedirect.com/journal/thin-walled-structures,Q1,1178
Telematics and Informatics,https://www.journals.elsevier.com/telematics-and-informatics,Q1,476
Biomaterials Science,https://www.rsc.org/journals-books-databases/about-journals/biomaterials-science/,Q1,702
Journal of Sound and Vibration,https://www.journals.elsevier.com/journal-of-sound-and-vibration,Q1,1735
CIS Iron and Steel Review,http://rudmet.ru/catalog/journals/details/30/,Q1,61
Computing and Visualization in Science,https://www.springer.com/journal/791,Q1,30
International Journal for Numerical and Analytical Methods in Geomechanics,https://onlinelibrary.wiley.com/journal/10969853,Q1,313
Innovative Food Science and Emerging Technologies,http://www.elsevier.com/wps/find/journaldescription.cws_home/620381/description#description,Q1,648
Critical Reviews in Solid State and Materials Sciences,https://www.tandfonline.com/toc/bsms20/current,Q1,48
Frontiers in Marine Science,https://www.frontiersin.org/journals/marine-science,Q1,1211
International Journal of Precision Engineering and Manufacturing - Green Technology,https://www.springer.com/engineering/industrial+management/journal/40684,Q1,170
IEEE Transactions on Biomedical Engineering,https://ieeexplore.ieee.org/xpl/RecentIssue.jsp?punumber=10,Q1,854
Environmental and Resource Economics,https://www.springer.com/journal/10640,Q1,348
Physics of Fluids,https://aip.scitation.org/journal/phf,Q1,1866
IEEE Electron Device Letters,https://ieeexplore.ieee.org/xpl/RecentIssue.jsp?punumber=55,Q1,1279
Nonlinear Dynamics,hhttps://www.springer.com/journal/11071,Q1,2248
Production Planning and Control,https://www.tandfonline.com/toc/tppc20/current,Q1,299
Industrial Management and Data Systems,https://www.emerald.com/insight/publication/issn/0263-5577,Q1,313
Experimental Thermal and Fluid Science,https://www.journals.elsevier.com/experimental-thermal-and-fluid-science,Q1,1047
Frontiers in Neuroinformatics,https://www.frontiersin.org/journals/neuroinformatics,Q1,225
Metabolic Engineering Communications,https://www.sciencedirect.com/journal/metabolic-engineering-communications,Q1,60
"Nanomedicine: Nanotechnology, Biology, and Medicine",https://www.journals.elsevier.com/nanomedicine-nanotechnology-biology-and-medicine,Q1,687
Materials and Structures/Materiaux et Constructions,https://www.springer.com/journal/11527,Q1,810
International Journal of Food Microbiology,https://www.journals.elsevier.com/international-journal-of-food-microbiology,Q1,958
IEEE Transactions on Network and Service Management,https://ieeexplore.ieee.org/xpl/RecentIssue.jsp?punumber=4275028,Q1,280
IEEE Reviews in Biomedical Engineering,https://ieeexplore.ieee.org/xpl/RecentIssue.jsp?punumber=4664312,Q1,73
IET Control Theory and Applications,https://digital-library.theiet.org/content/journals/iet-cta,Q1,941
Sustainable Cities and Society,https://www.journals.elsevier.com/sustainable-cities-and-society,Q1,938
Sustainable Materials and Technologies,https://www.journals.elsevier.com/sustainable-materials-and-technologies,Q1,65
IEEE Journal of Selected Topics in Quantum Electronics,https://ieeexplore.ieee.org/xpl/RecentIssue.jsp?punumber=2944,Q1,775
Eurasian Mining,http://rudmet.ru/catalog/journals/details/28/,Q1,69
Nanotoxicology,https://www.tandfonline.com/toc/inan20/current,Q1,330
Journal of Materials Chemistry B,https://www.rsc.org/journals-books-databases/about-journals/journal-of-materials-chemistry-b/,Q1,2470
IEEE/ACM Transactions on Audio Speech and Language Processing,https://ieeexplore.ieee.org/xpl/RecentIssue.jsp?punumber=6570655,Q1,574
Journal of Nanobiotechnology,https://jnanobiotechnology.biomedcentral.com/,Q1,279
Synthetic and Systems Biotechnology,http://www.keaipublishing.com/en/journals/synthetic-and-systems-biotechnology/,Q1,107
Wear,https://www.journals.elsevier.com/wear,Q1,1022
Journal of Bridge Engineering,https://ascelibrary.org/journal/jbenf2,Q1,544
Journal of Building Performance Simulation,https://www.tandfonline.com/toc/tbps20/current,Q1,129
Marine Structures,https://www.journals.elsevier.com/marine-structures,Q1,249
Maritime Policy and Management,https://www.tandfonline.com/loi/tmpm20,Q1,198
Journal of Field Robotics,https://onlinelibrary.wiley.com/journal/15564967,Q1,198
Indoor Air,https://onlinelibrary.wiley.com/journal/16000668,Q1,286
IEEE Journal of Biomedical and Health Informatics,https://jbhi.embs.org/,Q1,554
IEEE Transactions on Circuits and Systems for Video Technology,https://ieeexplore.ieee.org/xpl/RecentIssue.jsp?punumber=76,Q1,700
Cancer Nanotechnology,https://cancer-nano.biomedcentral.com/,Q1,32
International Journal of Engine Research,https://journals.sagepub.com/home/jer,Q1,263
