Nombre,Enlace,Categoria,CantidadArticulos
International Journal of Applied Metaheuristic Computing,https://www.scimagojr.com/journalsearch.php?q=21100858129&tip=sid&clean=0,Q4,16
Sankhya: The Indian Journal of Statistics,http://sankhya.isical.ac.in/,Q4,63
Memoirs on Differential Equations and Mathematical Physics,https://www.scimagojr.com/journalsearch.php?q=21100305006&tip=sid&clean=0,Q4,67
Rynek Energii,https://www.scimagojr.com/journalsearch.php?q=19700174650&tip=sid&clean=0,Q4,153
Applied and Computational Mechanics,https://www.kme.zcu.cz/acm/acm/index,Q4,37
Communications in Statistics Case Studies Data Analysis and Applications,https://www.scimagojr.com/journalsearch.php?q=21100948959&tip=sid&clean=0,Q4,32
International Journal of Chemical Sciences (discontinued),https://www.tsijournals.com/journals/international-journal-of-chemical-sciences.html,Q4,293
CFD Letters,https://www.scimagojr.com/journalsearch.php?q=21100198926&tip=sid&clean=0,Q4,8
Journal of Laboratory Medicine,https://www.scimagojr.com/journalsearch.php?q=21100893350&tip=sid&clean=0,Q4,20
Revue Francophone des Laboratoires (discontinued),http://www.elsevier.com/wps/find/journaldescription.cws_home/706434/description#description,Q4,239
Annales Mathematicae et Informaticae,https://www.scimagojr.com/journalsearch.php?q=19600157016&tip=sid&clean=0,Q4,57
Far East Journal of Mathematical Sciences (discontinued),http://www.pphmj.com/journals/fjms.htm,Q4,681
"JP Journal of Algebra, Number Theory and Applications (discontinued)",http://www.pphmj.com/journals/jpanta.htm,Q4,106
College Mathematics Journal,https://www.scimagojr.com/journalsearch.php?q=21100198426&tip=sid&clean=0,Q4,192
International Journal of Mathematical Models and Methods in Applied Sciences (discontinued),https://www.scimagojr.com/journalsearch.php?q=18100156703&tip=sid&clean=0,Q4,48
Pakistan Journal of Engineering and Applied Sciences,https://journal.uet.edu.pk/ojs_old/index.php/pjeas,Q4,27
Electronics and Communications in Japan,https://www.scimagojr.com/journalsearch.php?q=19700188800&tip=sid&clean=0,Q4,306
Journal of Mathematical Control Science and Applications,https://www.scimagojr.com/journalsearch.php?q=21100877663&tip=sid&clean=0,Q4,29
Strategic Design Research Journal,https://www.scimagojr.com/journalsearch.php?q=21100886216&tip=sid&clean=0,Q4,36
ACM Communications in Computer Algebra,https://www.sigsam.org/cca/,Q4,86
IIUM Engineering Journal,https://journals.iium.edu.my/ejournal/index.php/iiumej,Q4,105
"Neural, Parallel and Scientific Computations (discontinued)",http://acadsol.eu/npsc/home,Q4,11
Control and Cybernetics,https://www.scimagojr.com/journalsearch.php?q=12928&tip=sid&clean=0,Q4,58
Fibonacci Quarterly,https://www.fq.math.ca/,Q4,168
International Journal of Imaging and Robotics (discontinued),http://www.ceser.in/ceserp/index.php/iji,Q4,80
International Journal of Innovative Computing and Applications,http://www.inderscience.com/browse/index.php?journalID=215,Q4,66
Open Cybernetics and Systemics Journal,https://www.scimagojr.com/journalsearch.php?q=21100199572&tip=sid&clean=0,Q4,51
PNA,https://revistaseug.ugr.es/index.php/pna/index,Q4,20
Advanced Science Letters (discontinued),https://www.scimagojr.com/journalsearch.php?q=19700181106&tip=sid&clean=0,Q4,3761
International Journal of Power and Energy Systems,http://www.actapress.com/Content_of_Journal.aspx?JournalID=117,Q4,53
Journal of Mathematical Sciences (Japan),http://www.ms.u-tokyo.ac.jp/journal/index_e.html,Q4,28
Computer Science,https://journals.agh.edu.pl/csci,Q4,48
Educacion Matematica,https://www.revista-educacion-matematica.org.mx/revista/,Q4,34
Journal of Analysis and Applications,http://sasip.net/jaa_index.html,Q4,21
Prikladnaya Matamatika i Mekhanika,https://www.scimagojr.com/journalsearch.php?q=25816&tip=sid&clean=0,Q4,1
"Modelling, Measurement and Control B (discontinued)",https://www.scimagojr.com/journalsearch.php?q=28515&tip=sid&clean=0,Q4,88
Applied Mathematical Sciences (discontinued),http://www.m-hikari.com/ams/,Q4,195
Baghdad Science Journal,http://bsj.uobaghdad.edu.iq/index.php/BSJ,Q4,167
Central European Journal of Economic Modelling and Econometrics,http://cejeme.org/,Q4,32
Information and Control,http://ic.sia.cn/EN/column/column111.shtml,Q4,92
Mathematical Biology and Bioinformatics,https://www.scimagojr.com/journalsearch.php?q=21100212321&tip=sid&clean=0,Q4,112
Pythagoras,https://pythagoras.org.za/index.php/pythagoras,Q4,25
Tamsui Oxford Journal of Information and Mathematical Sciences,https://ibi.au.edu.tw/p/404-1018-51558.php?Lang=zh-tw,Q4,33
British Journal for the History of Mathematics,https://www.scimagojr.com/journalsearch.php?q=21100938727&tip=sid&clean=0,Q4,61
Fundamental and Applied Mathematics,http://mech.math.msu.su/~fpm/eng/efpmosn.htm,Q4,114
Journal for Geometry and Graphics,http://www.emis.de/journals/JGG/,Q4,69
"Advances in modelling and analysis. A, general mathematical and computer tools (discontinued)",http://www.iieta.org/Journals/AMA_A,Q4,153
AStA Wirtschafts- und Sozialstatistisches Archiv (discontinued),http://www.springer.com/statistics/business%2C+economics+%26+finance/journal/11943,Q4,57
Science and Technology Asia,https://www.scimagojr.com/journalsearch.php?q=21100902543&tip=sid&clean=0,Q4,32
Advances in Modelling and Analysis C (discontinued),https://www.scimagojr.com/journalsearch.php?q=28046&tip=sid&clean=0,Q4,43
Journal of Japan Industrial Management Association,https://www.scimagojr.com/journalsearch.php?q=144786&tip=sid&clean=0,Q4,86
Advances in Modelling and Analysis B,https://www.scimagojr.com/journalsearch.php?q=28044&tip=sid&clean=0,Q4,76
Journal of Statistics Applications and Probability,https://www.scimagojr.com/journalsearch.php?q=21100898973&tip=sid&clean=0,Q4,40
Systems and Computers in Japan,http://www3.interscience.wiley.com/journal/51986/home,Q4,2
Formalized Mathematics (discontinued),http://fm.mizar.org/,Q4,26
Poincare Journal of Analysis and Applications,https://www.scimagojr.com/journalsearch.php?q=21100898620&tip=sid&clean=0,Q4,17
REVUE ROUMAINE DE MATHEMATIQUES PURES ET APPLIQUEES,https://www.scimagojr.com/journalsearch.php?q=21100847882&tip=sid&clean=0,Q4,26
ITNOW,https://www.scimagojr.com/journalsearch.php?q=145549&tip=sid&clean=0,Q4,192
Teaching of Mathematics,https://www.scimagojr.com/journalsearch.php?q=21100913650&tip=sid&clean=0,Q4,25
In Silico Biology,http://www.bioinfo.de/isb/,Q4,3
International Journal of Business Continuity and Risk Management,https://www.scimagojr.com/journalsearch.php?q=21100890137&tip=sid&clean=0,Q4,20
International Journal of Mathematics and Computers in Simulation (discontinued),https://www.scimagojr.com/journalsearch.php?q=17700156720&tip=sid&clean=0,Q4,49
"International Journal of Simulation: Systems, Science and Technology (discontinued)",http://ijssst.info/,Q4,1749
International Journal of Soft Computing (discontinued),https://www.scimagojr.com/journalsearch.php?q=17200154704&tip=sid&clean=0,Q4,49
Journal of Logic and Analysis,http://logicandanalysis.org/,Q4,15
International Journal of Mechatronics and Automation,https://www.scimagojr.com/journalsearch.php?q=21100325719&tip=sid&clean=0,Q4,26
Pakistan Journal of Scientific and Industrial Research Series A: Physical Sciences,https://www.pjsir.org/,Q4,79
Cryptologia (discontinued),http://www.informaworld.com/smpp/title~content=t725304178~db=all,Q4,65
Lecture Notes of TICMI,https://www.emis.de/journals/TICMI/lnt/lecturen.htm,Q4,4
Mathematische Semesterberichte,http://www.springer.com/mathematics/journal/591,Q4,45
"Modelling, Measurement and Control A (discontinued)",https://www.scimagojr.com/journalsearch.php?q=28513&tip=sid&clean=0,Q4,72
Network Biology (discontinued),http://www.iaees.org/publications/journals/nb/nb.asp,Q4,19
Recta,https://www.scimagojr.com/journalsearch.php?q=21100199556&tip=sid&clean=0,Q4,30
Statistica e Applicazioni,http://statisticaeapplicazioni.vitaepensiero.it/,Q4,14
World Journal of Modelling and Simulation (discontinued),http://www.wjms.org.uk/,Q4,16
Bulletin of the Kyushu Institute of Technology - Pure and Applied Mathematics,https://www.scimagojr.com/journalsearch.php?q=21100236827&tip=sid&clean=0,Q4,6
Konstruktion,https://www.scimagojr.com/journalsearch.php?q=22705&tip=sid&clean=0,Q4,485
Jordan Journal of Mathematics and Statistics,https://www.scimagojr.com/journalsearch.php?q=21100871803&tip=sid&clean=0,Q4,21
JP Journal of Geometry and Topology (discontinued),https://www.scimagojr.com/journalsearch.php?q=19700188162&tip=sid&clean=0,Q4,35
Surveys in Mathematics and its Applications,http://www.utgjiu.ro/math/sma/,Q4,9
Advanced Studies in Theoretical Physics (discontinued),http://www.m-hikari.com/astp/,Q4,29
Avances de Investigacion en Educacion Matematica,https://www.scimagojr.com/journalsearch.php?q=21100904317&tip=sid&clean=0,Q4,12
International Journal of Mathematical Analysis (discontinued),https://www.scimagojr.com/journalsearch.php?q=17300154704&tip=sid&clean=0,Q4,95
Journal of Algebra and Applied Mathematics,http://sasip.net/jaads_index.html,Q4,24
Bollettino di Storia delle Scienze Matematiche,https://www.scimagojr.com/journalsearch.php?q=19800188079&tip=sid&clean=0,Q4,20
Journal of Prime Research in Mathematics,https://www.scimagojr.com/journalsearch.php?q=21100238411&tip=sid&clean=0,Q4,29
"Matematica, Cultura e Societa",https://www.scimagojr.com/journalsearch.php?q=21100904887&tip=sid&clean=0,Q4,26
Mathematics Teaching-Research Journal,https://www.scimagojr.com/journalsearch.php?q=21100933994&tip=sid&clean=0,Q4,45
Philippine Statistician,http://www.psai.ph/tps.php?page=1&max=10,Q4,28
