Nombre,Enlace,Categoria,CantidadArticulos
Biomedica : revista del Instituto Nacional de Salud,https://revistabiomedica.org/index.php/biomedica,Q3,374
"Mental Health, Religion and Culture",http://www.informaworld.com/smpp/title~content=t713437783~db=all,Q3,255
Obere Extremitat,http://www.springeronline.com/journal/11678/about,Q3,113
Polish Journal of Radiology,http://www.polradiol.com/,Q3,353
BJS open,https://www.scimagojr.com/journalsearch.php?q=21100942216&tip=sid&clean=0,Q3,15
Clinical Microbiology Newsletter,http://www.elsevier.com/wps/find/journaldescription.cws_home/505755/description#description,Q3,115
Journal of Mid-Life Health,http://www.jmidlifehealth.org/,Q3,133
Medicine and Pharmacy Reports,https://www.scimagojr.com/journalsearch.php?q=21100916457&tip=sid&clean=0,Q3,222
Open Neuroimaging Journal,https://openneuroimagingjournal.com/,Q3,31
Revista Clinica Espanola,http://www.doyma.es/revistas/ctl_servlet?_f=7032&revistaid=65,Q3,355
Annals of Pediatric Cardiology,https://www.scimagojr.com/journalsearch.php?q=19700175088&tip=sid&clean=0,Q3,215
Drug Metabolism and Personalized Therapy,https://www.degruyter.com/view/j/dmdi,Q3,87
"Journal of the Royal College of Physicians of Edinburgh, The",http://www.rcpe.ac.uk/journal/index.php,Q3,245
VideoGIE,https://www.videogie.org/,Q3,324
World Journal of Clinical Cases,https://www.scimagojr.com/journalsearch.php?q=21100874917&tip=sid&clean=0,Q3,162
Doklady Biochemistry and Biophysics,https://www.springer.com/journal/10628,Q3,326
Educacion Medica,https://www.elsevier.es/es-revista-educacion-medica-71,Q3,264
Journal of Medical Imaging and Radiation Oncology,http://www.wiley.com/bw/journal.asp?ref=1754-9477,Q3,498
Acta Ortopedica Brasileira,http://www.scielo.br/scielo.php/script_sci_serial/pid_1413-7852/lng_en/nrm_iso,Q3,213
Asia-Pacific Journal of Oncology Nursing,https://www.scimagojr.com/journalsearch.php?q=21100886348&tip=sid&clean=0,Q3,66
Eastern Mediterranean Health Journal,http://www.emro.who.int/Publications/emhj/index.asp,Q3,434
European Journal of Mass Spectrometry,http://www.impublications.com/journal/ejms,Q3,151
International Ophthalmology Clinics,http://journals.lww.com/internat-ophthalmology/pages/default.aspx,Q3,150
Iranian Red Crescent Medical Journal (discontinued),https://www.scimagojr.com/journalsearch.php?q=17700155031&tip=sid&clean=0,Q3,752
Revista Colombiana de Psiquiatria,https://www.journals.elsevier.com/revista-colombiana-de-psiquiatria,Q3,169
Tropical Life Sciences Research,http://www.tlsr.usm.my/,Q3,100
Clinical and Experimental Neuroimmunology,https://www.scimagojr.com/journalsearch.php?q=19700188334&tip=sid&clean=0,Q3,182
Epidemiologia e prevenzione,https://www.scimagojr.com/journalsearch.php?q=13139&tip=sid&clean=0,Q3,394
Journal of the American Podiatric Medical Association,http://www.japmaonline.org/,Q3,292
Lung India,https://www.scimagojr.com/journalsearch.php?q=19700174898&tip=sid&clean=0,Q3,503
Neuropsychiatrie,http://www.dustri.com/nc/de/deutschsprachige-zeitschriften/mag/neuropsychiatrie.html,Q3,88
Indian Journal of Plastic Surgery,http://www.ijps.org/,Q3,231
"Linacre quarterly, The",https://www.scimagojr.com/journalsearch.php?q=17109&tip=sid&clean=0,Q3,131
Recent Patents on Anti-Infective Drug Discovery,https://benthamscience.com/journals/recent-patents-on-anti-infective-drug-discovery/,Q3,49
Clinica e Investigacion en Arteriosclerosis,http://www.doyma.es/revistas/ctl_servlet?_f=7032&revistaid=15,Q3,131
Hellenic Journal of Nuclear Medicine,http://nuclmed.web.auth.gr/magazine/index.htm,Q3,205
International Journal of Cancer Management,http://intjcancermanag.com/en/index.html,Q3,342
International Journal of Mental Health Promotion,https://www.tandfonline.com/loi/rijm20,Q3,41
Recent Patents on Drug Delivery and Formulation,https://benthamscience.com/journals/recent-patents-on-drug-delivery-and-formulation/,Q3,60
Science of Gymnastics Journal,https://www.scimagojr.com/journalsearch.php?q=21100220434&tip=sid&clean=0,Q3,79
Virus Adaptation and Treatment,https://www.scimagojr.com/journalsearch.php?q=19700175079&tip=sid&clean=0,Q3,8
"Zentralblatt fur Arbeitsmedizin, Arbeitsschutz und Ergonomie",https://www.scimagojr.com/journalsearch.php?q=12511&tip=sid&clean=0,Q3,214
Experimental Oncology,http://exp-oncology.dev.morion.com.ua/,Q3,179
Family Practice Management,http://www.aafp.org/online/en/home/publications/journals/fpm.html,Q3,213
Hand Therapy,https://www.scimagojr.com/journalsearch.php?q=21100202930&tip=sid&clean=0,Q3,47
Indian Journal of Dental Research,http://www.ijdr.in/,Q3,418
North Carolina Medical Journal,http://www.ncmedicaljournal.com/,Q3,331
Journal of Healthcare Management,http://www.ache.org/pubs/jhmsub.cfm,Q3,235
Pediatrics in Review,http://pedsinreview.aappublications.org/,Q3,416
Respirology Case Reports,https://onlinelibrary.wiley.com/journal/20513380,Q3,182
Revista do Colegio Brasileiro de Cirurgioes,http://www.scielo.br/scielo.php?script=sci_serial&pid=0100-6991&lng=en&nrm=iso,Q3,256
Dermatology Online Journal,https://escholarship.org/uc/doj,Q3,780
International Journal of Child Care and Education Policy,https://www.scimagojr.com/journalsearch.php?q=21100901159&tip=sid&clean=0,Q3,40
Iranian Journal of Child Neurology,https://www.scimagojr.com/journalsearch.php?q=19700174989&tip=sid&clean=0,Q3,162
Korean Journal of Thoracic and Cardiovascular Surgery,https://www.scimagojr.com/journalsearch.php?q=21100199842&tip=sid&clean=0,Q3,279
Pediatric Endocrinology Reviews,http://www.medicalmedia.co.il/per/,Q3,150
"Philosophy, Psychiatry and Psychology",https://www.scimagojr.com/journalsearch.php?q=21100203112&tip=sid&clean=0,Q3,145
Polish Journal of Microbiology,http://www.pjmonline.org/,Q3,188
Seminars in Cardiothoracic and Vascular Anesthesia,http://scv.sagepub.com/,Q3,135
ADMET and DMPK,http://pub.iapchem.org/ojs/index.php/admet/index,Q3,71
Clinical Social Work Journal,http://www.springer.com/psychology/psychology+general/journal/10615,Q3,130
Diabetology International,https://www.scimagojr.com/journalsearch.php?q=19700177504&tip=sid&clean=0,Q3,146
Indian Journal of Occupational and Environmental Medicine,http://www.ijoem.com/,Q3,97
Journal of Functional Morphology and Kinesiology,https://www.scimagojr.com/journalsearch.php?q=21100902910&tip=sid&clean=0,Q3,149
Journal of Pediatric Neurosciences,http://www.pediatricneurosciences.com/,Q3,349
Neurosciences,http://www.nsj.org.sa/,Q3,191
US Neurology,https://www.touchneurology.com/journals/us-neurology,Q3,7
Electronic Journal of General Medicine,https://www.scimagojr.com/journalsearch.php?q=21100858173&tip=sid&clean=0,Q3,205
Indian Journal of Nephrology,https://www.scimagojr.com/journalsearch.php?q=19700174991&tip=sid&clean=0,Q3,362
Indian Journal of Sexually Transmitted Diseases,http://www.ijstd.org/,Q3,87
International Journal of Adolescent Medicine and Health,https://www.degruyter.com/view/j/ijamh?lang=en,Q3,388
Romanian Journal of Legal Medicine,http://www.rjlm.ro/,Q3,237
Tizard Learning Disability Review,https://www.emeraldgrouppublishing.com/tldr.htm,Q3,96
International Journal of Urological Nursing,http://www.wiley.com/bw/journal.asp?ref=1749-7701,Q3,59
"Iranian Journal of Obstetrics, Gynecology and Infertility",https://www.scimagojr.com/journalsearch.php?q=19700174804&tip=sid&clean=0,Q3,449
Journal of Community Hospital Internal Medicine Perspectives,https://www.tandfonline.com/toc/zjch20/current,Q3,16
Journal of Nursing Measurement,http://www.springerpub.com/product/10613749,Q3,150
Monash bioethics review,http://arts.monash.edu.au/bioethics/mbr/,Q3,29
Neuroendocrinology Letters,http://www.nel.edu/home.htm,Q3,285
BioLaw Journal,http://rivista.biodiritto.org/ojs/index.php?journal=biolaw,Q3,149
Cutis,http://www.cutis.com/asp/archive/pastissues.asp,Q3,739
Indian journal of medical ethics,http://www.issuesinmedicalethics.org/,Q3,213
Journal of Pharmacology and Pharmacotherapeutics,https://www.scimagojr.com/journalsearch.php?q=21100209502&tip=sid&clean=0,Q3,125
Journal of Prevention and Intervention in the Community,http://www.informaworld.com/smpp/title~content=t792306944~db=all,Q3,86
Nephrologie et Therapeutique,https://www.journals.elsevier.com/nephrologie-and-therapeutique,Q3,241
Computer Assisted Surgery,https://www.tandfonline.com/loi/icsu20,Q3,104
Journal Francais d'Ophtalmologie,http://www.elsevier.com/wps/find/journaldescription.cws_home/709579/description#description,Q3,825
Journal of Forensic Nursing,http://www.wiley.com/bw/journal.asp?ref=1556-3693,Q3,120
Journal of Workplace Behavioral Health,http://www.informaworld.com/smpp/title~content=t792306921~db=all,Q3,48
Medical Journal of the Islamic Republic of Iran,https://www.scimagojr.com/journalsearch.php?q=17840&tip=sid&clean=0,Q3,249
Netherlands Journal of Medicine,https://www.scimagojr.com/journalsearch.php?q=26691&tip=sid&clean=0,Q3,415
Revista Peruana de Medicina de Experimental y Salud Publica,https://rpmesp.ins.gob.pe/index.php/rpmesp,Q3,377
Schmerz,http://www.springer.com/medicine/journal/482,Q3,242
South African Journal of Clinical Nutrition,http://www.sajcn.co.za/index.php/SAJCN,Q3,103
Turkish Journal of Ophthalmology,http://www.oftalmoloji.org/,Q3,111
Ulusal Travma ve Acil Cerrahi Dergisi,https://www.scimagojr.com/journalsearch.php?q=34839&tip=sid&clean=0,Q3,304
Infectious Disorders - Drug Targets,https://benthamscience.com/journals/infectious-disorders-drug-targets/,Q3,88
Medicinski Glasnik,http://ljkzedo.ba/medicinski-glasnik/,Q3,98
Medsurg nursing : official journal of the Academy of Medical-Surgical Nurses,http://www.medsurgnursing.net/cgi-bin/WebObjects/MSNJournal.woa,Q3,226
Open Respiratory Medicine Journal,https://benthamopen.com/TORMJ/home/,Q3,31
Studies in Health Technology and Informatics,http://www.iospress.nl/html/shti.php,Q3,2818
Bulletin of the Hospital for Joint Disease (2013),http://hjdbulletin.org/,Q3,140
Der Anaesthesist,http://www.springer.com/medicine/anesthesiology/journal/101,Q3,389
Food and Drug Law Journal,http://www.fdli.org/pubs/Journal%20Online/,Q3,64
GE Portuguese Journal of Gastroenterology,https://www.karger.com/Journal/Home/272027,Q3,231
Journal of Green Building,https://www.journalofgreenbuilding.com/,Q3,114
Therapeutic Communities,http://www.cyc-net.org/Journals/ijtso.html,Q3,68
Turkish Journal of Medical Sciences,http://journals.tubitak.gov.tr/medical/index.htm,Q3,767
Asian Pacific Journal of Reproduction,http://www.apjr.net/,Q3,202
Journal of the Saudi Heart Association,https://www.journals.elsevier.com/journal-of-the-saudi-heart-association,Q3,161
Occupational Therapy in Health Care,http://informahealthcare.com/ohc,Q3,92
Ophthalmologe,http://www.springer.com/medicine/ophthalmology/journal/347,Q3,567
Urologia,https://www.scimagojr.com/journalsearch.php?q=20539&tip=sid&clean=0,Q3,117
Central European Journal of Public Health,http://www1.szu.cz/svi/cejph/index_en.php,Q3,222
Der Unfallchirurg,http://www.springer.com/medicine/journal/113,Q3,472
Die Rehabilitation,http://www.thieme.de/fz/rehabilitation/index.html,Q3,162
Pathologica,http://www.springer.com/medicine/pathology/journal/10242,Q3,96
Sultan Qaboos University Medical Journal,https://www.scimagojr.com/journalsearch.php?q=19900191824&tip=sid&clean=0,Q3,319
Doklady Biological Sciences,http://www.springer.com/life+sciences/journal/10630,Q3,214
Pravention und Gesundheitsforderung,http://www.springer.com/medicine/health+informatics/journal/11553,Q3,139
Respiratory Medicine Case Reports,https://www.scimagojr.com/journalsearch.php?q=21100203501&tip=sid&clean=0,Q3,499
Tanaffos,https://www.scimagojr.com/journalsearch.php?q=19700174982&tip=sid&clean=0,Q3,150
"Acta crystallographica. Section C, Structural chemistry",https://www.scimagojr.com/journalsearch.php?q=21100316073&tip=sid&clean=0,Q3,569
Annales Medico-Psychologiques,http://www.elsevier.com/wps/find/journaldescription.cws_home/622288/description#description,Q3,478
British Journal of Psychotherapy,https://onlinelibrary.wiley.com/journal/17520118,Q3,133
Health Care Manager,http://journals.lww.com/healthcaremanagerjournal/pages/default.aspx,Q3,149
Pneumologie,http://www.thieme.de/fz/pneumologie/index.html,Q3,280
Case Reports in Nephrology and Dialysis,https://www.karger.com/Journal/Home/254804,Q3,84
Current Cardiovascular Imaging Reports,https://www.scimagojr.com/journalsearch.php?q=19600157307&tip=sid&clean=0,Q3,111
"Einstein (SaÌƒo Paulo, Brazil)",https://journal.einstein.br/instructions-for-authors/,Q3,299
Journal of Intergenerational Relationships,http://www.informaworld.com/smpp/title~content=t792306900~db=all,Q3,99
Revista de Nutricao,http://www.puc-campinas.edu.br/centros/ccv/revistas/revistanutricao.htm,Q3,208
Turkish Thoracic Journal,https://www.turkthoracj.org/,Q3,86
Acta odontologica latinoamericana : AOL,http://actaodontologicalat.com/,Q3,34
Current Psychiatry Research and Reviews,https://www.scimagojr.com/journalsearch.php?q=21100936011&tip=sid&clean=0,Q3,103
Emergency Medicine International,https://www.hindawi.com/journals/emi/,Q3,8
"Healthcare quarterly (Toronto, Ont.)",http://www.longwoods.com/home.php?cat=249,Q3,186
Isokinetics and Exercise Science,http://www.iospress.nl/loadtop/load.php?isbn=09593020,Q3,123
Open Access Macedonian Journal of Medical Sciences,https://www.id-press.eu/mjms/index,Q3,870
Sampling Theory in Signal and Image Processing,https://www.scimagojr.com/journalsearch.php?q=4400151733&tip=sid&clean=0,Q3,10
Klinische Monatsblatter fur Augenheilkunde,http://www.thieme.de/fz/klimo/index.html,Q3,693
Nutricion Hospitalaria,https://www.nutricionhospitalaria.org/,Q3,921
"Research in Psychotherapy: Psychopathology, Process and Outcome",https://www.scimagojr.com/journalsearch.php?q=20100195008&tip=sid&clean=0,Q3,61
Southeast Asian Journal of Tropical Medicine and Public Health,https://www.tm.mahidol.ac.th/seameo/publication.htm,Q3,328
Tanzania Journal of Health Research,https://www.scimagojr.com/journalsearch.php?q=14200154710&tip=sid&clean=0,Q3,116
Zeitschrift fur Gefassmedizin,http://www.kup.at/journals/gefaessmedizin/,Q3,45
Boletin de Malariologia y Salud Ambiental,https://www.scimagojr.com/journalsearch.php?q=19900193610&tip=sid&clean=0,Q3,45
International Journal of Radiation Research,http://ijrr.com,Q3,163
Journal of Medical Signals and Sensors,http://jmss.mui.ac.ir/index.php/jmss,Q3,96
Sportverletzung-Sportschaden,http://www.thieme.de/fz/sport/index.html,Q3,169
Artificial DNA: PNA and XNA,https://www.scimagojr.com/journalsearch.php?q=19700188408&tip=sid&clean=0,Q3,1
Indian Journal of Cancer,http://www.indianjcancer.com/,Q3,412
Medical History,http://www.ucl.ac.uk/histmed/publications/med_hist,Q3,81
Revista Brasileira de Ginecologia e Obstetricia,http://www.scielo.br/scielo.php?script=sci_serial&pid=0100-7203&lng=en&nrm=iso,Q3,336
Techniques in Foot and Ankle Surgery,http://journals.lww.com/techfootankle/pages/default.aspx,Q3,108
Trends in Anaesthesia and Critical Care,https://www.journals.elsevier.com/trends-in-anaesthesia-and-critical-care,Q3,159
Wound Medicine,https://www.scimagojr.com/journalsearch.php?q=21100256962&tip=sid&clean=0,Q3,77
Cancer Treatment and Research Communications,https://www.journals.elsevier.com/cancer-treatment-and-research-communications,Q3,119
Cardiovascular Therapy and Prevention (Russian Federation),https://cardiovascular.elpub.ru/jour/article/view/940?locale=en_US,Q3,261
Fukushima Journal of Medical Sciences,http://www.fmu.ac.jp/home/lib/F-igaku/index.html,Q3,61
Israel Journal of Psychiatry and Related Sciences,https://www.scimagojr.com/journalsearch.php?q=16224&tip=sid&clean=0,Q3,88
Postepy w Kardiologii Interwencyjnej,http://www.termedia.pl/magazine.php?magazine_id=35&magazine_subpage=CURRENT,Q3,226
Revista Espanola de Salud Publica,https://www.mscbs.gob.es/biblioPublic/publicaciones/recursos_propios/resp/home.htm,Q3,203
Stapp car crash journal,https://www.scimagojr.com/journalsearch.php?q=5300152701&tip=sid&clean=0,Q3,46
Wisconsin Medical Journal,http://www.wisconsinmedicalsociety.org/wmj,Q3,201
Journal of Medical Case Reports,http://www.jmedicalcasereports.com/,Q3,1132
Science and Sports,http://www.elsevier.com/wps/find/journaldescription.cws_home/505822/description#description,Q3,234
Shokuhin eiseigaku zasshi. Journal of the Food Hygienic Society of Japan,http://www.shokuhineisei.jp/,Q3,114
IJC Metabolic and Endocrine,https://www.scimagojr.com/journalsearch.php?q=21100283766&tip=sid&clean=0,Q3,59
"Journal of Physical Education, Recreation and Dance",https://www.scimagojr.com/journalsearch.php?q=21100890306&tip=sid&clean=0,Q3,106
Medicina Historica,https://mattiolihealth.com/medicina-historica/,Q3,50
Physical Therapy Reviews,https://www.tandfonline.com/loi/yptr20,Q3,98
Acta Medica Iranica,http://journals.tums.ac.ir/description.aspx?org_id=59&culture_var=en&journal_id=2&issue_id=1792&segment=en,Q3,443
Current Ophthalmology Reports,https://www.scimagojr.com/journalsearch.php?q=21100967252&tip=sid&clean=0,Q3,100
Current Topics in Nutraceutical Research,https://www.nchpjournals.com/Journal,Q3,21
"Annals of the Academy of Medicine, Singapore",http://www.annals.edu.sg/,Q3,313
"Ear, Nose and Throat Journal",https://www.scimagojr.com/journalsearch.php?q=13676&tip=sid&clean=0,Q3,576
Folia Medica,https://www.scimagojr.com/journalsearch.php?q=39363&tip=sid&clean=0,Q3,179
International Journal of High Risk Behaviors and Addiction,http://jhrba.com/en/index.html,Q3,157
Journal of Applied Pharmaceutical Science,http://www.japsonline.com/,Q3,1040
Journal of Clinical Ethics,http://www.clinicalethics.com/,Q3,114
MEDICC Review,http://mediccreview.org/,Q3,121
Minerva Chirurgica,http://www.minervamedica.it/en/journals/minerva-chirurgica/index.php,Q3,207
Psychiatry and Clinical Psychopharmacology,https://www.scimagojr.com/journalsearch.php?q=21100874322&tip=sid&clean=0,Q3,231
Romanian journal of ophthalmology,http://www.rjo.ro/,Q3,53
American Journal of Case Reports,https://www.amjcaserep.com/,Q3,782
Anti-Inflammatory and Anti-Allergy Agents in Medicinal Chemistry,https://benthamscience.com/journals/anti-inflammatory-and-anti-allergy-agents-in-medicinal-chemistry,Q3,52
Bulletin Epidemiologique Hebdomadaire,https://www.scimagojr.com/journalsearch.php?q=19700175837&tip=sid&clean=0,Q3,25
Cardiovascular Endocrinology and Metabolism,https://www.scimagojr.com/journalsearch.php?q=21100873333&tip=sid&clean=0,Q3,83
Future Neurology,http://www.futuremedicine.com/loi/fnl,Q3,85
Ghana Medical Journal,https://www.ajol.info/index.php/gmj,Q3,104
Indian Journal of Medical and Paediatric Oncology,http://www.ijmpo.org/,Q3,332
International Journal of Health Governance,http://emeraldgrouppublishing.com/products/journals/journals.htm?id=ijhg,Q3,91
Journal of Sport and Health Research,http://www.journalshr.com/,Q3,34
Advances in Dual Diagnosis,https://www.scimagojr.com/journalsearch.php?q=21100247024&tip=sid&clean=0,Q3,47
Gynecology and Minimally Invasive Therapy,https://www.scimagojr.com/journalsearch.php?q=21100317204&tip=sid&clean=0,Q3,160
Malaysian Orthopaedic Journal,https://www.morthoj.org/,Q3,142
Turkish Journal of Surgery,https://turkjsurg.com/,Q3,248
Journal of Hard Tissue Biology,https://www.scimagojr.com/journalsearch.php?q=19400157005&tip=sid&clean=0,Q3,181
Medycyna Doswiadczalna i Mikrobiologia,https://www.scimagojr.com/journalsearch.php?q=20255&tip=sid&clean=0,Q3,9
Nanomedicine Research Journal,https://www.scimagojr.com/journalsearch.php?q=21100967718&tip=sid&clean=0,Q3,80
Orthopedic Research and Reviews,https://www.dovepress.com/orthopedic-research-and-reviews-journal,Q3,27
Prescriber,https://onlinelibrary.wiley.com/journal/19312253,Q3,20
Professional Case Management,http://journals.lww.com/professionalcasemanagementjournal/pages/default.aspx,Q3,178
Canadian Journal of Addiction,https://csam-smca.org/canadian-journal-of-addiction/,Q3,64
Gastroenterologia y Hepatologia,http://www.doyma.es/revistas/ctl_servlet?_f=7032&revistaid=14,Q3,404
IEEE Pulse,https://pulse.embs.org/,Q3,216
Safer Communities,https://www.scimagojr.com/journalsearch.php?q=19700174682&tip=sid&clean=0,Q3,58
Swiss dental journal,https://www.swissdentaljournal.org/home.html,Q3,115
Apunts Medicina de l'Esport,https://www.scimagojr.com/journalsearch.php?q=7200153126&tip=sid&clean=0,Q3,70
Boletin Medico del Hospital Infantil de Mexico,http://www.bmhim.com/,Q3,186
East African Medical Journal,http://ajol.info/index.php/eamj,Q3,10
"Hindsight (Saint Louis, Mo.)",https://www.scimagojr.com/journalsearch.php?q=66457&tip=sid&clean=0,Q3,3
Pharmaceutical patent analyst,https://www.scimagojr.com/journalsearch.php?q=21100318814&tip=sid&clean=0,Q3,97
Technology and Health Care,http://www.iospress.nl/loadtop/load.php?isbn=09287329,Q3,488
Asian Pacific Journal of Tropical Disease,https://www.scimagojr.com/journalsearch.php?q=21100197903&tip=sid&clean=0,Q3,364
Cardiovascular and Hematological Agents in Medicinal Chemistry,https://benthamscience.com/journals/cardiovascular-and-hematological-agents-in-medicinal-chemistry/,Q3,58
Current Nanoscience,https://benthamscience.com/journals/current-nanomaterials/,Q3,242
Diagnostic and Therapeutic Endoscopy,http://www.hindawi.com/journals/dte/,Q3,13
Egyptian Heart Journal,https://tehj.springeropen.com/,Q3,168
Kardiochirurgia i Torakochirurgia Polska,https://www.scimagojr.com/journalsearch.php?q=19700188108&tip=sid&clean=0,Q3,201
Air Medical Journal,http://www.airmedicaljournal.com/,Q3,286
Chinese Journal of Endemiology,http://eng.med.wanfangdata.com.cn/JournalDetail.aspx?qid=zgdfbxzz,Q3,825
Diagnosis,http://91.203.202.198/view/j/dx,Q3,86
Journal of LGBT Issues in Counseling,http://www.informaworld.com/smpp/title~content=t792306926~db=all,Q3,69
JPMA. The Journal of the Pakistan Medical Association,http://jpma.org.pk/,Q3,1443
Medicina Clinica,http://www.doyma.es/revistas/ctl_servlet?_f=7032&revistaid=2,Q3,1188
Open Access Surgery,https://www.dovepress.com/open-access-surgery-journal,Q3,3
History of Psychiatry,http://hpy.sagepub.com/,Q3,91
Kobe Journal of Medical Sciences,https://www.scimagojr.com/journalsearch.php?q=16529&tip=sid&clean=0,Q3,69
Annales de Biologie Clinique,http://www.revue-abc.com/,Q3,285
Epilepsy Research and Treatment,https://www.hindawi.com/journals/ert/,Q3,6
Indian Journal of Surgery,https://www.springer.com/journal/12262,Q3,405
Minerva Pediatrica,http://www.minervamedica.it/en/journals/minerva-pediatrica/index.php,Q3,269
Motriz. Revista de Educacao Fisica,https://www.scimagojr.com/journalsearch.php?q=19900191750&tip=sid&clean=0,Q3,150
Periodicum Biologorum,https://www.scimagojr.com/journalsearch.php?q=12990&tip=sid&clean=0,Q3,113
Postepy biochemii,http://www.postepybiochemii.pl/,Q3,124
Psychological Studies,https://www.springer.com/journal/12646,Q3,124
Der Nervenarzt,http://www.springer.com/medicine/journal/115,Q3,584
International Journal of Morphology,http://www.intjmorphol.com/international-journal-of-morphology/,Q3,714
Nigerian Journal of Clinical Practice,http://ajol.info/index.php/njcp,Q3,712
Stomatologija,https://www.scimagojr.com/journalsearch.php?q=3900148511&tip=sid&clean=0,Q3,60
European Surgery - Acta Chirurgica Austriaca,http://www.springer.com/springerwiennewyork/medicine/journal/10353,Q3,184
Journal of Prosthetics and Orthotics,https://journals.lww.com/jpojournal/pages/default.aspx,Q3,104
Revista brasileira de enfermagem,http://www.scielo.br/scielo.php?script=sci_serial&pid=0034-7167&lng=en&nrm=iso,Q3,775
Acta Biotheoretica,http://www.springer.com/philosophy/philosophy+of+sciences/journal/10441,Q3,64
Acta Informatica Medica,https://www.scimagojr.com/journalsearch.php?q=21100203503&tip=sid&clean=0,Q3,199
Archives of Pediatric Infectious Diseases,http://pedinfect.com/en/index.html,Q3,135
"Chirurgia (Bucharest, Romania : 1990)",http://www.revistachirurgia.ro/,Q3,276
Global journal of health science,https://www.scimagojr.com/journalsearch.php?q=21100218323&tip=sid&clean=0,Q3,34
Irish Journal of Psychological Medicine,https://www.scimagojr.com/journalsearch.php?q=16221&tip=sid&clean=0,Q3,153
Journal of Social Work in Disability and Rehabilitation,https://www.tandfonline.com/toc/wswd20/current,Q3,45
Pharmaceutical Medicine,https://www.scimagojr.com/journalsearch.php?q=19700189100&tip=sid&clean=0,Q3,95
World health & population,http://www.longwoods.com/home.php?cat=381,Q3,5
Ceylon Medical Journal,http://www.sljol.info/index.php/CMJ,Q3,39
Current Protocols in Nucleic Acid Chemistry,http://cda.currentprotocols.com/WileyCDA/CPTitle/isbn-047124662X.html,Q3,64
Journal of Integrative Neuroscience,http://jin.imrpress.org/,Q3,148
Revista de Gastroenterologia de Mexico,http://www.elsevier.es/revistas/ctl_servlet?_f=7032&revistaid=288,Q3,194
Assistive Technology,http://www.informaworld.com/smpp/title~content=t910220176~db=all,Q3,106
Indian Journal of Radiology and Imaging,http://www.ijri.org/,Q3,289
Neonatal network : NN,https://www.scimagojr.com/journalsearch.php?q=28765&tip=sid&clean=0,Q3,193
Neurocirugia,http://scielo.isciii.es/scielo.php?script=sci_serial&pid=1130-1473&lng=en&nrm=iso,Q3,136
Roczniki Panstwowego Zakladu Higieny,https://www.scimagojr.com/journalsearch.php?q=22468&tip=sid&clean=0,Q3,149
Academic Forensic Pathology,https://www.scimagojr.com/journalsearch.php?q=21100925779&tip=sid&clean=0,Q3,224
Annals of African Medicine,http://www.annalsafrmed.org/,Q3,127
Handchirurgie Mikrochirurgie Plastische Chirurgie,http://www.thieme.de/thiememedia/zeitschriften/hamipla.html,Q3,240
Turk Jinekoloji ve Obstetrik Dernegi Dergisi,http://www.tjoddergisi.org/eng/jvi.asp,Q3,163
Ulster Medical Journal,http://www.ums.ac.uk/journal.html,Q3,198
Annales de Cardiologie et d'Angeiologie,http://www.elsevier.com/wps/find/journaldescription.cws_home/621360/description#description,Q3,241
Archives of Clinical Infectious Diseases,http://archcid.com/en/index.html,Q3,189
European Journal of Translational Myology,https://www.scimagojr.com/journalsearch.php?q=21100873619&tip=sid&clean=0,Q3,35
Hospital Pharmacy,https://journals.sagepub.com/home/hpxa,Q3,347
Indian Journal of Pathology and Microbiology,http://www.ijpmonline.org/,Q3,529
