Nombre,Enlace,Categoria,CantidadArticulos
Archives of Environmental and Occupational Health,http://www.heldref.org/pubs/aeoh/about.html,Q4,155
Arhiv za Higijenu Rada i Toksikologiju,http://www.versita.com/science/medicine/aiht,Q4,122
Anil Aggrawal's Internet Journal of Forensic Medicine and Toxicology,https://www.scimagojr.com/journalsearch.php?q=27715&tip=sid&clean=0,Q4,11
Birth Defects Research Part B - Developmental and Reproductive Toxicology,http://www3.interscience.wiley.com/journal/102527215/home,Q4,21
Fluoride - Quarterly Reports,http://www.fluoride-journal.com/,Q4,119
Journal of Environmental Biology,http://www.jeb.co.in/,Q4,531
Toxicologie Analytique et Clinique,https://www.scimagojr.com/journalsearch.php?q=21100376682&tip=sid&clean=0,Q4,126
Toxicology and Environmental Health Sciences,https://www.scimagojr.com/journalsearch.php?q=21100226424&tip=sid&clean=0,Q4,122
Archives of Clinical Infectious Diseases,http://archcid.com/en/index.html,Q4,189
ATLA Alternatives to Laboratory Animals,http://www.bfr.bund.de/cd/4446,Q4,103
Current Computer-Aided Drug Design,https://benthamscience.com/journals/current-computer-aided-drug-design/,Q4,106
Natural Products Journal,https://benthamscience.com/journals/the-natural-products-journal/,Q4,107
Current Enzyme Inhibition,https://benthamscience.com/journals/current-enzyme-inhibition/,Q4,63
Interaction Design and Architecture(s),http://interfacce.mifav.uniroma2.it/inevent/events/idea2010/index.php?s=9#,Q4,109
Current Traditional Medicine,https://benthamscience.com/journals/current-traditional-medicine/,Q4,2
"Journal of Herbs, Spices and Medicinal Plants",https://www.tandfonline.com/loi/whsm20,Q4,98
Research Journal of Environmental Toxicology (discontinued),http://scialert.net/jindex.php?issn=1819-3420,Q4,25
Natural Product Communications,https://journals.sagepub.com/home/npx,Q4,1310
Journal of Biologically Active Products from Nature,https://www.scimagojr.com/journalsearch.php?q=21100902935&tip=sid&clean=0,Q4,111
Archivos Venezolanos de Farmacologia y Terapeutica,http://www.revistaavft.com/,Q4,147
Actualites Pharmaceutiques,http://www.elsevier.com/wps/find/journaldescription.cws_home/620088/description#description,Q4,520
Pharmaceutical Chemistry Journal,http://www.springer.com/biomed/pharmaceutical+science/journal/11094,Q4,561
Archives of Razi Institute,https://www.scimagojr.com/journalsearch.php?q=21100228007&tip=sid&clean=0,Q4,98
Physiology and Pharmacology,http://ppj.phypha.ir/,Q4,104
"Journal of Receptor, Ligand and Channel Research",https://www.scimagojr.com/journalsearch.php?q=19700174632&tip=sid&clean=0,Q4,3
Biomedical and Pharmacology Journal,http://biomedpharmajournal.org/,Q4,701
EnvironmentAsia,https://www.scimagojr.com/journalsearch.php?q=15600154705&tip=sid&clean=0,Q4,114
Chinese Pharmacological Bulletin,https://ores.su/en/journals/chinese-pharmacological-bulletin/,Q4,1014
Oriental Journal of Chemistry (discontinued),http://www.orientjchem.org/,Q4,1090
Phytotherapie,http://www.springer.com/medicine/journal/10298,Q4,263
Journal of Xenobiotics,https://www.pagepressjournals.org/index.php/xeno/,Q4,2
Recent Patents on CNS Drug Discovery,http://www.bentham.org/rpcn/index.htm,Q4,18
Anti-Infective Agents,https://benthamscience.com/journals/anti-infective-agents/,Q4,56
Journal of Pharmacognosy and Phytotherapy (discontinued),https://academicjournals.org/journal/JPP,Q4,19
Research Journal of Toxins (discontinued),https://www.scimagojr.com/journalsearch.php?q=19700174987&tip=sid&clean=0,Q4,2
Epitheorese Klinikes Farmakologias kai Farmakokinetikes,https://www.scimagojr.com/journalsearch.php?q=21292&tip=sid&clean=0,Q4,43
Journal of Medicinal Plants,http://jmp.ir/en,Q4,201
Revista Cubana de Plantas Medicinales,http://www.revplantasmedicinales.sld.cu/index.php/pla,Q4,121
Current Psychopharmacology,https://benthamscience.com/journals/current-psychopharmacology/,Q4,16
Herba Polonica,http://www.herbapolonica.pl/pages/view/home-page,Q4,27
International Journal of Medicinal Chemistry,https://www.hindawi.com/journals/ijmc/,Q4,3
Journal of Natural Remedies,http://www.informaticsjournals.com/index.php/jnr,Q4,55
Current Issues in Pharmacy and Medical Sciences,https://content.sciendo.com/view/journals/cipms/cipms-overview.xml,Q4,119
Indian Journal of Physiology and Pharmacology,https://www.ijpp.com/,Q4,189
International Journal of Computational Biology and Drug Design,https://www.scimagojr.com/journalsearch.php?q=19600161802&tip=sid&clean=0,Q4,63
Current Metabolomics,https://benthamscience.com/journals/current-metabolomics-and-systems-biology/,Q4,6
Pharmacopeial Forum (discontinued),https://www.scimagojr.com/journalsearch.php?q=4700152769&tip=sid&clean=0,Q4,31
Indian Journal of Forensic Medicine and Toxicology,http://www.ijfmt.com/,Q4,463
Journal of Punjab Academy of Forensic Medicine and Toxicology,https://www.scimagojr.com/journalsearch.php?q=19900194914&tip=sid&clean=0,Q4,113
Biosciences Biotechnology Research Asia (discontinued),http://www.biotech-asia.org/,Q4,241
International Journal of Phytomedicine (discontinued),https://www.scimagojr.com/journalsearch.php?q=19700188355&tip=sid&clean=0,Q4,63
Japanese Pharmacology and Therapeutics,https://www.scimagojr.com/journalsearch.php?q=22858&tip=sid&clean=0,Q4,399
Drug Invention Today,http://jprsolutions.info/view_journal_new.php?journal_id=2,Q4,719
VacciMonitor,https://www.scimagojr.com/journalsearch.php?q=21100208082&tip=sid&clean=0,Q4,39
Geneesmiddelenbulletin,https://www.scimagojr.com/journalsearch.php?q=21867&tip=sid&clean=0,Q4,86
"Immunology, Endocrine and Metabolic Agents in Medicinal Chemistry",https://benthamscience.com/journals/immunology-endocrine-and-metabolic-agents-in-medicinal-chemistry,Q4,43
Current Topics in Toxicology,https://www.scimagojr.com/journalsearch.php?q=13000154717&tip=sid&clean=0,Q4,24
Pharmacologyonline,http://www.pharmacologyonline.unisa.it/,Q4,244
Dhaka University Journal of Pharmaceutical Sciences (discontinued),https://www.scimagojr.com/journalsearch.php?q=19700174893&tip=sid&clean=0,Q4,97
BioPharm International,http://biopharminternational.findpharma.com/biopharm,Q4,381
Japanese Journal of Chemotherapy,http://journal.chemotherapy.or.jp/,Q4,73
Medicinal Plants - International Journal of Phytomedicines and Related Industries,https://www.indianjournals.com/ijor.aspx?target=ijor:mpijpri&type=home,Q4,142
Acta Pharmaceutica Hungarica (discontinued),https://www.scimagojr.com/journalsearch.php?q=19399&tip=sid&clean=0,Q4,40
Zeitschrift fur Phytotherapie : offizielles Organ der Ges. f. Phytotherapie e.V,https://www.thieme-connect.de/ejournals/toc/phyto,Q4,187
Current Therapeutics,https://www.scimagojr.com/journalsearch.php?q=59522&tip=sid&clean=0,Q4,1
Indian Journal of Novel Drug Delivery,http://www.ijndd.net/,Q4,1
Pharmaceutical Crops,https://benthamopen.com/TOPHARMCJ/home/,Q4,1
International Journal of Pharmaceutical Compounding,http://www.ijpc.com/,Q4,203
Iranian Journal of Pharmaceutical Sciences,http://www.ijps.ir/,Q4,87
Klinicka Farmakologie a Farmacie,https://www.scimagojr.com/journalsearch.php?q=19700175098&tip=sid&clean=0,Q4,88
Sangyo eiseigaku zasshi = Journal of occupational health,https://www.scimagojr.com/journalsearch.php?q=110141&tip=sid&clean=0,Q4,53
African Journal Biomedical Research,https://www.scimagojr.com/journalsearch.php?q=19700175149&tip=sid&clean=0,Q4,130
International Journal of Pharmaceutical Quality Assurance,https://www.scimagojr.com/journalsearch.php?q=21100204506&tip=sid&clean=0,Q4,113
Pharma Times,https://www.scimagojr.com/journalsearch.php?q=5200152604&tip=sid&clean=0,Q4,208
Journal of China Pharmaceutical University,http://zgyaokdxxb.periodicals.net.cn/default.html,Q4,312
Ars Pharmaceutica (discontinued),http://farmacia.ugr.es/ars/arsen.php,Q4,57
Current Trends in Biotechnology and Pharmacy,https://www.abap.co.in/,Q4,102
Indian Drugs,https://www.indiandrugsonline.org/,Q4,362
International Journal of Pharmacognosy and Phytochemical Research (discontinued),https://ijppr.com/,Q4,302
Journal of International Peacekeeping,https://www.scimagojr.com/journalsearch.php?q=19900191564&tip=sid&clean=0,Q4,32
"Research Journal of Pharmaceutical, Biological and Chemical Sciences (discontinued)",https://www.rjpbcs.com/,Q4,2235
International Journal of Current Pharmaceutical Research,https://innovareacademics.in/journals/index.php/ijcpr,Q4,4
International Journal of Pharmaceutical and Clinical Research (discontinued),http://ijpcr.com/.,Q4,223
Current Topics in Pharmacology,https://www.scimagojr.com/journalsearch.php?q=9100153105&tip=sid&clean=0,Q4,27
Drugs of the Future,http://journals.prous.com/journals/servlet/xmlxsl/pk_journals.xml_about_pr?p_JournalID=2,Q4,253
International Journal of Research in Pharmaceutical Sciences,https://pharmascope.org/index.php/ijrps/,Q4,409
Accounting,https://www.scimagojr.com/journalsearch.php?q=21100943519&tip=sid&clean=0,Q4,4
Drug Development and Delivery,https://www.scimagojr.com/journalsearch.php?q=17600155051&tip=sid&clean=0,Q4,205
Revista de Toxicologia (discontinued),http://www.aetox.com/?page_id=26,Q4,50
European Journal of Oncology Pharmacy,https://journals.lww.com/ejop/pages/default.aspx,Q4,13
Pharmaceutical Sciences Asia,https://www.pharmacy.mahidol.ac.th/journal/,Q4,48
Pharmaceuticals Policy and Law,https://www.scimagojr.com/journalsearch.php?q=19700182122&tip=sid&clean=0,Q4,57
U.S. Pharmacist,https://www.scimagojr.com/journalsearch.php?q=22358&tip=sid&clean=0,Q4,386
Vitae,https://aprendeenlinea.udea.edu.co/revistas/index.php/vitae,Q4,221
Current Pharmacogenomics and Personalized Medicine,https://benthamscience.com/journals/current-pharmacogenomics-and-personalized-medicine/,Q4,51
Journal of Chemical and Pharmaceutical Sciences (discontinued),https://www.jchps.com/home.php,Q4,895
Botulinum Journal,https://www.scimagojr.com/journalsearch.php?q=19700200880&tip=sid&clean=0,Q4,6
Pharmacoeconomics - Spanish Research Articles,https://www.springer.com/journal/40277,Q4,36
Asia Pacific Journal of Medical Toxicology,http://apjmt.mums.ac.ir/,Q4,2
Chinese Journal of Pharmacology and Toxicology,http://202.38.153.236:81/Jweb_cjpt/EN/volumn/current.shtml,Q4,359
International Journal of Drug Delivery Technology,https://ijddt.com/,Q4,91
Journal of Nanopharmaceutics and Drug Delivery,https://www.scimagojr.com/journalsearch.php?q=21100854827&tip=sid&clean=0,Q4,2
Orphan Drugs: Research and Reviews,https://www.dovepress.com/orphan-drugs-research-and-reviews-archive136-v954,Q4,4
Revista Cubana de Farmacia,http://bvs.sld.cu/revistas/far/indice.html,Q4,116
Folia Pharmacologica Japonica,https://www.scimagojr.com/journalsearch.php?q=21840&tip=sid&clean=0,Q4,308
Japanese Journal of Clinical Pharmacology and Therapeutics,http://www.jstage.jst.go.jp/browse/jscpt,Q4,99
Journal of International Pharmaceutical Research,http://ijprjournals.com/index.php,Q4,292
Russian Journal of Biopharmaceuticals,https://www.scimagojr.com/journalsearch.php?q=19700194018&tip=sid&clean=0,Q4,148
Drug Discovery World,https://www.scimagojr.com/journalsearch.php?q=73076&tip=sid&clean=0,Q4,86
Journal of the Indian Chemical Society,http://indianchemicalsociety.com/journal/,Q4,316
BioProcess International,https://www.scimagojr.com/journalsearch.php?q=19700174961&tip=sid&clean=0,Q4,106
Journal of Jilin University Medicine Edition,http://bqeykdxxb.periodicals.net.cn/default.html,Q4,543
International Journal of Pharma Medicine and Biological Sciences,http://www.ijpmbs.com/,Q4,3
International Journal of Toxicological and Pharmacological Research (discontinued),https://www.scimagojr.com/journalsearch.php?q=21100205709&tip=sid&clean=0,Q4,71
Journal of Medical Marketing,http://www.palgrave-journals.com/jmm/index.html,Q4,5
Pharmaceutical Care Espana (discontinued),https://www.scimagojr.com/journalsearch.php?q=21083&tip=sid&clean=0,Q4,31
Vojenske Zdravotnicke Listy,https://www.scimagojr.com/journalsearch.php?q=20826&tip=sid&clean=0,Q4,13
Chinese Journal of New Drugs,https://www.scimagojr.com/journalsearch.php?q=19700174922&tip=sid&clean=0,Q4,1527
Eksperimental'naya i Klinicheskaya Farmakologiya,http://folium.ru/ru/journals/ekf/contents.htm,Q4,286
Journal of Generic Medicines (discontinued),http://www.palgrave-journals.com/jgm/index.html,Q4,30
American Journal of Pharmacology and Toxicology (discontinued),https://www.scimagojr.com/journalsearch.php?q=5400152620&tip=sid&clean=0,Q4,4
Blutalkohol (discontinued),https://www.scimagojr.com/journalsearch.php?q=25253&tip=sid&clean=0,Q4,50
Bulletin of Pharmaceutical Sciences,https://www.scimagojr.com/journalsearch.php?q=21100204921&tip=sid&clean=0,Q4,4
International Journal of Medical Toxicology and Legal Medicine,https://www.indianjournals.com/ijor.aspx?target=ijor:ijmtlm&type=home,Q4,117
Journal of Global Trends in Pharmaceutical Sciences,https://www.jgtps.com/,Q4,4
Molecular and Cellular Pharmacology,https://www.scimagojr.com/journalsearch.php?q=19700174906&tip=sid&clean=0,Q4,6
Research Journal of Pharmacology (discontinued),https://www.scimagojr.com/journalsearch.php?q=19700175031&tip=sid&clean=0,Q4,4
Archives of Pharmacy Practice,https://archivepp.com/en,Q4,5
Chinese Journal of Pharmaceutical Biotechnology,http://www.ywswjs.com/,Q4,366
European Journal of Parenteral and Pharmaceutical Sciences,https://www.scimagojr.com/journalsearch.php?q=19700174811&tip=sid&clean=0,Q4,18
Open Access Journal of Medicinal and Aromatic Plants,http://epubs.icar.org.in/ejournal/index.php/JMAP/about,Q4,11
Oral Therapeutics and Pharmacology,https://www.scimagojr.com/journalsearch.php?q=86349&tip=sid&clean=0,Q4,34
Drug Delivery System,https://www.scimagojr.com/journalsearch.php?q=19700175108&tip=sid&clean=0,Q4,197
Farmacevtski Vestnik (discontinued),http://www.sfd.si/?viewPage=19,Q4,55
Journal of Phytomedicine and Therapeutics,https://www.scimagojr.com/journalsearch.php?q=94365&tip=sid&clean=0,Q4,6
Toxicology International,http://www.informaticsjournals.com/index.php/toxi,Q4,109
Anales de la Real Academia Nacional de Farmacia (discontinued),http://www.analesranf.com/index.php/aranf,Q4,117
Arzneimitteltherapie,https://www.scimagojr.com/journalsearch.php?q=19700174886&tip=sid&clean=0,Q4,480
Pharmaceutical Technology,http://pharmtech.findpharma.com/,Q4,675
S.T.P. Pharma Pratiques,http://www.sfstp.org/article.php?id_article=137,Q4,9
Chinese Journal of Cancer Biotherapy,http://www.biother.org/zgzlswzlzzen/ch/first_menu.aspx?parent_id=20091216110333001,Q4,249
Farmaceuticky Obzor (discontinued),https://www.scimagojr.com/journalsearch.php?q=21795&tip=sid&clean=0,Q4,13
GMP Review,https://www.scimagojr.com/journalsearch.php?q=21100202747&tip=sid&clean=0,Q4,24
International Journal of Pharmacy and Technology (discontinued),https://www.scimagojr.com/journalsearch.php?q=19700201471&tip=sid&clean=0,Q4,1937
Pharmaceutical Journal,http://www.pharmpress.com/shop/product_display.asp?ProductID=00316873,Q4,349
Pharmaceutical Processing,https://www.scimagojr.com/journalsearch.php?q=19700175034&tip=sid&clean=0,Q4,79
"Therapeutics, Pharmacology and Clinical Toxicology",https://www.scimagojr.com/journalsearch.php?q=19900195040&tip=sid&clean=0,Q4,10
Adverse Drug Reaction Bulletin,http://www.lww.com/product/?0044-6394,Q4,18
Anti-Tumor Pharmacy,https://www.zgzlyx.com/,Q4,24
EPC - European Pharmaceutical Contractor,https://www.scimagojr.com/journalsearch.php?q=21334&tip=sid&clean=0,Q4,25
Japanese Journal of Neuropsychopharmacology,https://www.scimagojr.com/journalsearch.php?q=50105&tip=sid&clean=0,Q4,39
Pharmaceutical Engineering,http://www.ispe.org/cs/publications_section/pharmaceutical_engineering,Q4,209
Pharmaceutical Outsourcing,https://www.scimagojr.com/journalsearch.php?q=19700181403&tip=sid&clean=0,Q4,186
Pharmaceutisch Weekblad,https://www.scimagojr.com/journalsearch.php?q=21142&tip=sid&clean=0,Q4,1247
PharmacoVigilance Review,https://www.scimagojr.com/journalsearch.php?q=19700175580&tip=sid&clean=0,Q4,24
Pharmakeftiki,https://www.hsmc.gr/en/pharmakeftiki-journal/,Q4,34
Azerbaijan Pharmaceutical and Pharmacotherapy Journal,https://www.scimagojr.com/journalsearch.php?q=19700175121&tip=sid&clean=0,Q4,48
Circular Farmaceutica,http://sumaris.cbuc.es/cgis/revista.cgi?issn=03666425,Q4,81
Contract Pharma,https://www.scimagojr.com/journalsearch.php?q=19700173109&tip=sid&clean=0,Q4,268
Drug Topics,http://drugtopics.modernmedicine.com/drugtopics/issue/issueList.jsp?id=450,Q4,484
EBR - European Biopharmaceutical Review,https://www.scimagojr.com/journalsearch.php?q=50087&tip=sid&clean=0,Q4,106
Innovations in Pharmaceutical Technology,https://www.scimagojr.com/journalsearch.php?q=10600153336&tip=sid&clean=0,Q4,110
Journal of Forensic Medicine and Toxicology,https://www.scimagojr.com/journalsearch.php?q=27767&tip=sid&clean=0,Q4,68
Manufacturing Chemist,https://www.scimagojr.com/journalsearch.php?q=13637&tip=sid&clean=0,Q4,164
Pharmaceutical Manufacturing and Packing Sourcer,https://www.scimagojr.com/journalsearch.php?q=19700181430&tip=sid&clean=0,Q4,75
Pharmaceutical Technology Europe,http://pharmtech.findpharma.com/pharmtech/issue/issueDetail.jsp?id=18680,Q4,443
Pharmacy Times,https://www.scimagojr.com/journalsearch.php?q=21243&tip=sid&clean=0,Q4,674
Pharmazeutische Zeitung,http://www.pharmazeutische-zeitung.de/,Q4,2258
Revista de Ciencias Farmaceuticas Basica e Aplicada,http://200.145.71.150/seer/index.php/Cien_Farm,Q4,145
