Nombre,Enlace,Categoria,CantidadArticulos
Radiation Effects and Defects in Solids,http://www.informaworld.com/smpp/title~content=t713648881~db=all,Q3,296
Neutron News,https://www.scimagojr.com/journalsearch.php?q=19700187910&tip=sid&clean=0,Q3,103
Physics of Particles and Nuclei Letters,http://www.springer.com/new+%26+forthcoming+titles+%28default%29/journal/11497,Q3,481
Revista Brasileira de Ensino de Fisica,http://www.sbfisica.org.br/rbef/,Q3,231
Bulletin of Electrical Engineering and Informatics,https://journal.portalgaruda.org/index.php/EEI/index,Q3,130
Nonlinear Optics Quantum Optics,http://www.oldcitypublishing.com/NLOQO/NLOQO.html,Q3,58
Chalcogenide Letters,https://www.scimagojr.com/journalsearch.php?q=19200156904&tip=sid&clean=0,Q3,205
Journal of Physics: Conference Series,https://iopscience.iop.org/journal/1742-6596,Q3,31135
Bulletin of the Russian Academy of Sciences: Physics,http://www.springer.com/new+%26+forthcoming+titles+%28default%29/journal/11954,Q3,1034
Journal of Vibrational Engineering and Technologies,https://www.springer.com/journal/42417,Q3,169
Fluctuation and Noise Letters,http://www.worldscinet.com/fnl/fnl.shtml,Q3,123
Proceedings of the National Academy of Sciences India Section A - Physical Sciences,https://link.springer.com/journal/40010,Q3,217
Accreditation and Quality Assurance,http://www.springer.com/chemistry/analytical+chemistry/journal/769,Q3,150
Condensed Matter Physics,http://www.icmp.lviv.ua/journal/,Q3,168
Izvestiya Vysshikh Uchebnykh Zavedeniy. Prikladnaya Nelineynaya Dinamika,https://andjournal.sgu.ru/en,Q3,76
International Journal of Mechanics,https://www.scimagojr.com/journalsearch.php?q=19700166617&tip=sid&clean=0,Q3,126
Journal of Thermodynamics,https://www.scimagojr.com/journalsearch.php?q=21100217636&tip=sid&clean=0,Q3,15
Acta Physica Polonica A,http://www.ifpan.edu.pl/APP/,Q3,2095
Advances in Mathematical Physics,https://www.scimagojr.com/journalsearch.php?q=19900192029&tip=sid&clean=0,Q3,376
Akustika,https://www.scimagojr.com/journalsearch.php?q=21100217222&tip=sid&clean=0,Q3,55
Journal of the Korean Physical Society,https://www.scimagojr.com/journalsearch.php?q=28637&tip=sid&clean=0,Q3,1387
Advances in Acoustics and Vibration,https://www.hindawi.com/journals/aav/,Q3,42
Noise Control Engineering Journal,https://www.scimagojr.com/journalsearch.php?q=21565&tip=sid&clean=0,Q3,162
